"banner_image","fullname","images/0","images/1","images/2","images/3","in_reply_to/0","in_reply_to/1","in_reply_to/2","in_reply_to/3","language","likes","num_followers","num_following","query","quotes","replies","retweets","text","timestamp","total_likes","total_tweets","tweet_avatar","tweet_hashtags/0","tweet_hashtags/1","tweet_hashtags/2","tweet_hashtags/3","tweet_hashtags/4","tweet_hashtags/5","tweet_hashtags/6","tweet_hashtags/7","tweet_hashtags/8","tweet_hashtags/9","tweet_hashtags/10","tweet_hashtags/11","tweet_hashtags/12","tweet_hashtags/13","tweet_id","tweet_links/0","tweet_links/1","tweet_links/2","tweet_mentions/0","tweet_mentions/1","url","username"
,"Ruti",,,,,,,,,"id","0",,,"Gojek lang:in","0","1","0","Akhiri akhir bulan dengan melancholy and mental note: ""better naik gojek keluar duit sendiri mahal gpp drpd semobil gratis sama atasan""","2023-10-31 09:59:00+00:00",,,"https://pbs.twimg.com/profile_images/1662659576536399872/sCWw9MHU_400x400.jpg",,,,,,,,,,,,,,,"1719292917284774142",,,,,,"https://twitter.com/uma_umabe/status/1719292917284774142","@uma_umabe"
,"di-utara-kan",,,,,"@convomf",,,,"id","0",,,"Gojek lang:in","0","0","0","Ya Allah gw bgt ni sllu boong kalo di ajak basa basi abang gojek or org random, mager aja si ngmng yg sbnr nya","2023-10-31 10:02:00+00:00",,,"https://pbs.twimg.com/profile_images/1692557777280106496/6tBww_w8_400x400.jpg",,,,,,,,,,,,,,,"1719293783966208097",,,,,,"https://twitter.com/acaacatasya/status/1719293783966208097","@acaacatasya"
,"Jeff",,,,,,,,,"id","0",,,"Gojek lang:in","0","2","0","Wkwkwk anjing sebelah gua abang gojek lagi main slot","2023-10-31 09:55:00+00:00",,,"https://pbs.twimg.com/profile_images/1718478675296067584/zvUCpuvv_400x400.jpg",,,,,,,,,,,,,,,"1719291900002537486",,,,,,"https://twitter.com/gokil/status/1719291900002537486","@gokil"
,"risna",,,,,"@kegblgnunfaedh",,,,"id","0",,,"Gojek lang:in","0","0","0","Banyak banget, pernah sekali kena di stasiun depok baru driver gojek/grab yg model begini pas giliran udh turun di minta duit lebih😌","2023-10-31 09:55:00+00:00",,,"https://pbs.twimg.com/profile_images/1710230341447983104/T0_dyzEx_400x400.jpg",,,,,,,,,,,,,,,"1719291872760525200",,,,,,"https://twitter.com/Rah9797_/status/1719291872760525200","@Rah9797_"
,"Cruineseands",,,,,"@convomf",,,,"id","0",,,"Gojek lang:in","0","0","0","Wkwkwkwk w berani kek gini kalau yakin orangnya pasti ga ketemu lagi, abang gojek misalnya 😂. Tapi habis itu dimarahin sama emak karna bohong","2023-10-31 10:00:00+00:00",,,"https://pbs.twimg.com/profile_images/1631991126378029056/tsQ_r_Ia_400x400.jpg",,,,,,,,,,,,,,,"1719293351173017619",,,,,,"https://twitter.com/Catiscute9/status/1719293351173017619","@Catiscute9"
,"bubu.","https://pbs.twimg.com/media/FjR1e6UaUAEc7Y_.jpg?format=jpg&name=medium",,,,,,,,"id","34",,,"Gojek lang:in","6","3","5","Foto 1: 5 jam pemakaian
Vid 2: 11 jam pemakaian, udah kena air berulang kali, udah balik pake gojek juga wkwk
Vid 3: 12 jam

11 jam++ masih cetar dan lentik meskipun kena air 3x dan dipake motoran segala macem, must have item! No bleber bleber club!

shope.ee/1q2ZUizwDX","2022-12-06 07:42:00+00:00",,,"https://pbs.twimg.com/profile_images/1663938625275592704/QK8-TKG7_400x400.jpg",,,,,,,,,,,,,,,"1600032987814715392","https://shope.ee/1q2ZUizwDX",,,,,"https://twitter.com/jaesxc/status/1600032987814715392","@jaesxc"
,"。","https://pbs.twimg.com/media/F9vNrnwbYAAGosR.jpg?format=jpg&name=medium",,,,,,,,"id","0",,,"Gojek lang:in","0","0","0","so far ini paling jauh sih. gw tau tujuannya buat acquire market indriver, tp indriver gak ada biaya platfrom/order gak kyk gojek. jd wajar cust nego krn duitnya semua masuk ke driver. lah elu udh ada biaya platform yg gak berubah, malah mau nyekik mitra 😅😅😅","2023-10-31 09:49:00+00:00",,,"https://pbs.twimg.com/profile_images/1714689556774289408/-Sup1FD4_400x400.jpg",,,,,,,,,,,,,,,"1719290529996018119",,,,,,"https://twitter.com/shurimproll/status/1719290529996018119","@shurimproll"
,"z ༉‧₊˚.",,,,,,,,,"id","0",,,"Gojek lang:in","1","2","0","awkward situation adalah lu lagi duduk miring di gojek trs org sebelah lu adalah org yg lu kenal MANA MACET LG JING FGAKSJSJW","2023-10-31 09:53:00+00:00",,,"https://pbs.twimg.com/profile_images/1713184538455838720/qOXdB925_400x400.jpg",,,,,,,,,,,,,,,"1719291615347630357",,,,,,"https://twitter.com/kwmeela/status/1719291615347630357","@kwmeela"
,"ksoo",,,,,"@sharonanisya",,,,"id","0",,,"Gojek lang:in","0","1","0","nah ini kata temen w yg nnton dewa wktu ntu jg ssh bgtbgt jis tuu jau dr stasiun ama tj kudu naik gojek dlu lg","2023-10-31 09:52:00+00:00",,,"https://pbs.twimg.com/profile_images/1710085048601604096/wD_tY4Qb_400x400.jpg",,,,,,,,,,,,,,,"1719291357486006314",,,,,,"https://twitter.com/ayuurestiasih/status/1719291357486006314","@ayuurestiasih"
,"Kemal.",,,,,,,,,"id","0",,,"Gojek lang:in","0","0","0","Hem, alasan males naik gojek😔 brok aku dapet yang zonk mulu tiap berangkat sore","2023-10-31 09:52:00+00:00",,,"https://pbs.twimg.com/profile_images/1716218486320771072/_ZZLj9rd_400x400.jpg",,,,,,,,,,,,,,,"1719291310816043263",,,,,,"https://twitter.com/keluhankesah/status/1719291310816043263","@keluhankesah"
,"rief.",,,,,,,,,"id","0",,,"Gojek lang:in","0","0","0","Ke Cibubur, pesen gojek 2 x ngeselin semuanya, kok bisa","2023-10-31 09:48:00+00:00",,,"https://pbs.twimg.com/profile_images/1648932959100231680/100U55Ee_400x400.jpg",,,,,,,,,,,,,,,"1719290177162781123",,,,,,"https://twitter.com/riefrmn/status/1719290177162781123","@riefrmn"
,"cee☆🥟🌯",,,,,,,,,"de","0",,,"Gojek lang:in","0","0","0","APLIKASI GOJEK KNP SIH TOT","2023-10-31 09:53:00+00:00",,,"https://pbs.twimg.com/profile_images/1687115913705951233/VvHw7m-C_400x400.jpg",,,,,,,,,,,,,,,"1719291399936655499",,,,,,"https://twitter.com/sunkknoo/status/1719291399936655499","@sunkknoo"
,"Ana",,,,,,,,,"id","0",,,"Gojek lang:in","0","0","0","Bimbang antara nunggu ujan selesai trs naik gojek or langsung gocar 👎👎👎🥲 ahh fak kata gue teh","2023-10-31 09:51:00+00:00",,,"https://pbs.twimg.com/profile_images/1704086199609225216/5kXXc4KF_400x400.jpg",,,,,,,,,,,,,,,"1719291089373520186",,,,,,"https://twitter.com/isaxxna/status/1719291089373520186","@isaxxna"
,"jangan difollow","https://pbs.twimg.com/media/F9wmGypagAAFRvM.jpg?format=jpg&name=medium",,,,"@ungeeeblw","@convomf",,,"id","0",,,"Gojek lang:in","0","0","0","Pernah waktu pulang naik grab

""Kantor deket neng, mau langganan aja ga? gausah pake aplikasi""
""Ngga bang. Biasanya dianter suami, cuma emg dia lagi pergi aja makanya saya naik gojek""

Meanwhile my suami 🥰","2023-10-31 09:51:00+00:00",,,"https://pbs.twimg.com/profile_images/1688702566446850048/UCA08L4j_400x400.jpg",,,,,,,,,,,,,,,"1719291063016517671",,,,,,"https://twitter.com/karnaakuu/status/1719291063016517671","@karnaakuu"
,"tyasss",,,,,"@viemeda19",,,,"hr","0",,,"Gojek lang:in","0","0","0","Iyaa belom hotel, makan, printilan, gocar gojek dll","2023-10-31 09:50:00+00:00",,,"https://pbs.twimg.com/profile_images/1705977415128973312/MzHk-6Nb_400x400.png",,,,,,,,,,,,,,,"1719290851795571101",,,,,,"https://twitter.com/herniingtyas/status/1719290851795571101","@herniingtyas"
,"Mitra Gojek",,,,,"@kumparan",,,,"id","0",,,"Gojek lang:in","0","1","0","Apapun kebijakannya, tetep driver adalah korbannya👌👌👌","2023-10-31 09:53:00+00:00",,,"https://pbs.twimg.com/profile_images/1248457704567230464/TM-RDOjH_400x400.jpg",,,,,,,,,,,,,,,"1719291572964253923",,,,,,"https://twitter.com/wawanrmdns/status/1719291572964253923","@wawanrmdns"
,"dirzi |",,,,,"@cchynjiyaa",,,,"id","1",,,"Gojek lang:in","0","0","0","Tmn2 akuu pas nonton dewa katanya separah itu. Klo ancol kann masih banyak grab/gojek, ini ga ada. Dan parkirannya mereka diarahin ke PRJ gt jauh bgt wkwk. Trs banyak yg mau nyoba jemput di tempat tp jatohnya malah jdi macet parah","2023-10-31 09:46:00+00:00",,,"https://pbs.twimg.com/profile_images/1704524388996132864/D8p9grj6_400x400.jpg",,,,,,,,,,,,,,,"1719289818847584582",,,,,,"https://twitter.com/channchamm/status/1719289818847584582","@channchamm"
,"KangOjekSeringAFK",,,,,"@N_ShaniJKT48",,,,"tl","0",,,"Gojek lang:in","0","0","0","Sabarrr, orang sabar disayang wota","2023-10-31 09:44:00+00:00",,,"https://pbs.twimg.com/profile_images/1459102232423456769/u91-Iq4E_400x400.jpg",,,,,,,,,,,,,,,"1719289327015047419",,,,,,"https://twitter.com/GojekAFK/status/1719289327015047419","@GojekAFK"
,"aliesha 🌸",,,,,"@nseonoo",,,,"id","0",,,"Gojek lang:in","0","1","0","nggak bang, mau ngasih voucher gojek ya","2023-10-31 09:45:00+00:00",,,"https://pbs.twimg.com/profile_images/1718783041030737920/t7NylvpI_400x400.jpg",,,,,,,,,,,,,,,"1719289411836538912",,,,,,"https://twitter.com/bwutterrfly/status/1719289411836538912","@bwutterrfly"
,"KDslots777",,,,,,,,,"id","0",,,"Gojek lang:in","0","0","0","TAPI PASTI MUDAH KALAU DI KDSLOTS

Semua itu modah, yang penting pas jam jam siang kalau di game MAHJONG pasti alus percaya buktikan.

#kdslots #linkgacor #mahjong #infogacor #slotviral #linkviral #fyp #reels #igreels #lokerkerja #gojek #pekanbaru #jakartahits #jakartakeras","2023-10-31 09:43:00+00:00",,,"https://pbs.twimg.com/profile_images/1131022914990428160/Rat1A6M1_400x400.png","#kdslots","#linkgacor","#mahjong","#infogacor","#slotviral","#linkviral","#fyp","#reels","#igreels","#lokerkerja","#gojek","#pekanbaru","#jakartahits","#jakartakeras","1719288947288027362",,,,,,"https://twitter.com/kdslots777/status/1719288947288027362","@kdslots777"
,"Gen 103.1 Fm",,,,,,,,,"id","0",,,"Gojek lang:in","0","0","0","#InfoGen1031FM Gojek akan meluncurkan layanan baru di GoRide yang memungkinkan penumpang dan driver melakukan negosiasi untuk menyepakati bersama harga akhir perjalanan. Layanan baru bernama GoRide Nego ini akan hadir menjadi opsi baru.

#GOJEK #GoRide","2023-10-31 09:31:00+00:00",,,"https://pbs.twimg.com/profile_images/1098324099489624069/MMk4Bo-P_400x400.jpg","#InfoGen1031FM","#GOJEK","#GoRide",,,,,,,,,,,,"1719285934406213760",,,,,,"https://twitter.com/gen1031fmsby/status/1719285934406213760","@gen1031fmsby"
,"OjolSenja","https://pbs.twimg.com/media/F9vNrnwbYAAGosR.jpg?format=jpg&name=medium",,,,,,,,"id","0",,,"Gojek lang:in","0","0","0","Makin mundur dong sekelas gojek ikut²an kek gini. Yg pasti² aja udh bener ikut tarif @kemenhub151","2023-10-31 09:39:00+00:00",,,"https://pbs.twimg.com/profile_images/1625363238300057603/9BGtEclu_400x400.jpg",,,,,,,,,,,,,,,"1719287873068044784",,,,"kemenhub151",,"https://twitter.com/tukangngopihits/status/1719287873068044784","@tukangngopihits"
,"nda",,,,,,,,,"id","0",,,"Gojek lang:in","0","0","0","buat penghuni asrama dan make kulkas bersama tapi ga sesuai sop, semoga akun shopee/grab/gojek/maxim lu bau. ga perna dapet promoan. jari lu kepentok ujung meja. bantal lu panas di kedua sisi🙏🏻","2023-10-31 09:42:00+00:00",,,"https://pbs.twimg.com/profile_images/1717221085991833600/Yv8MVlKr_400x400.jpg",,,,,,,,,,,,,,,"1719288707159896112",,,,,,"https://twitter.com/corawrzon/status/1719288707159896112","@corawrzon"
,"An_Emo Boy","https://pbs.twimg.com/media/F9vNrnwbYAAGosR.jpg?format=jpg&name=medium",,,,,,,,"id","0",,,"Gojek lang:in","0","0","0","Gojek itu udah murah banget dibandingkan Opang, tarifnya juga jelas ada dasarnya dr pemerintah. Masih ngide buat nego itu otaknya kemana dah","2023-10-31 09:33:00+00:00",,,"https://pbs.twimg.com/profile_images/1668652122932494339/Z-wfhi-J_400x400.jpg",,,,,,,,,,,,,,,"1719286383217676336",,,,,,"https://twitter.com/GuiliAnemoBoy/status/1719286383217676336","@GuiliAnemoBoy"
,"Romadhon",,,,,"@AaOj3k","@kumparan",,,"id","2",,,"Gojek lang:in","0","0","0","Nadim itu ngikutin temennya yg duluan bikin grab
Selama ini gojek ngikutin aplikasi grab
Gw punya aplikasi gojek dan grab
Yg inovasi grab duluan, pasti gojek bakal ngikutin sama persis
Nah sekarang ada indrive, di ikutin lagi🤣","2023-10-31 09:35:00+00:00",,,"https://pbs.twimg.com/profile_images/1338483433476038656/ODa6ULsE_400x400.jpg",,,,,,,,,,,,,,,"1719286969900073290",,,,,,"https://twitter.com/Romadhon_W_D/status/1719286969900073290","@Romadhon_W_D"
,"jessieee",,,,,"@sbyfess",,,,"hr","0",,,"Gojek lang:in","0","0","0","maxim, gojek, ambe dijemput ayahku","2023-10-31 09:36:00+00:00",,,"https://pbs.twimg.com/profile_images/1706294952932855808/zB4VQrRl_400x400.jpg",,,,,,,,,,,,,,,"1719287160803938366",,,,,,"https://twitter.com/melo_dyyxs/status/1719287160803938366","@melo_dyyxs"
,"ren",,,,,,,,,"id","0",,,"Gojek lang:in","0","0","0","bawa mobil & kena macet gedangan garai misuh beneran, gojek my love 😥🫶","2023-10-31 09:41:00+00:00",,,"https://pbs.twimg.com/profile_images/1678080913652207616/TMGz95IY_400x400.jpg",,,,,,,,,,,,,,,"1719288377726714094",,,,,,"https://twitter.com/lrenxnj/status/1719288377726714094","@lrenxnj"
,"—",,,,,,,,,"sw","0",,,"Gojek lang:in","0","1","0","SAMA NJIR, mas gojek gojek suka nanya in ""mba tionghoa ya? mba cina ya?"" MASALAH LU APA??!!!!!","2023-10-31 09:41:00+00:00",,,"https://pbs.twimg.com/profile_images/1701304258958860290/AHudE5-y_400x400.jpg",,,,,,,,,,,,,,,"1719288476175347764",,,,,,"https://twitter.com/BEARUO4z/status/1719288476175347764","@BEARUO4z"
,"nana",,,,,"@lailyrinaa",,,,"id","0",,,"Gojek lang:in","0","0","0","woi itu gojek nahal amay. jauh ya","2023-10-31 09:40:00+00:00",,,"https://pbs.twimg.com/profile_images/1715620025258950656/Kui83lm3_400x400.jpg",,,,,,,,,,,,,,,"1719288349247283616",,,,,,"https://twitter.com/kzhikaru/status/1719288349247283616","@kzhikaru"
,"Herlily",,,,,"@fullmoonfolks",,,,"id","89",,,"Gojek lang:in","0","0","2","Ya ga usah gojek bayar aplikasi langsung aja opang duidny buat driver semua langsung","2023-10-31 06:19:00+00:00",,,"https://pbs.twimg.com/profile_images/1677189004/kursi_kuning_400x400.jpg",,,,,,,,,,,,,,,"1719237583526596836",,,,,,"https://twitter.com/her_fnu/status/1719237583526596836","@her_fnu"
,"ä","https://pbs.twimg.com/media/F9v_KJxbEAAy7zb.jpg?format=jpg&name=medium",,,,,,,,"hr","0",,,"Gojek lang:in","0","0","0","gue sama inez kalo pesen gojek dapet drivernya dani","2023-10-31 09:35:00+00:00",,,"https://pbs.twimg.com/profile_images/1668273783042617345/uPQ5CqK7_400x400.jpg",,,,,,,,,,,,,,,"1719286985012261123",,,,,,"https://twitter.com/monentuma/status/1719286985012261123","@monentuma"
,"chillzaa",,,,,"@convomf",,,,"id","0",,,"Gojek lang:in","0","0","0","Sama aku juga nder tiap sama tukang gojek jawabnya beda2, kalau dia tanya “kuliah kak?” Aku jawab “iya” kalau dia tanya “kerja kak?” Aku juga jawab “iya”, pernah juga di tanya “kenapa naik gojek” aku jawab aja “ suami belum pulang kerja” padahal mah yg deketin aja kagak ada 😭😭","2023-10-31 09:29:00+00:00",,,"https://pbs.twimg.com/profile_images/1689634726213275649/6bdgFBvY_400x400.jpg",,,,,,,,,,,,,,,"1719285501197484234",,,,,,"https://twitter.com/clynsaaa/status/1719285501197484234","@clynsaaa"
,"eja 🎪🧃","https://pbs.twimg.com/media/F9wgchDaIAAfncC.jpg?format=jpg&name=medium",,,,,,,,"id","0",,,"Gojek lang:in","0","0","0","Promo GOJEK (GO CAMPUS AMBASSADOR)📢

jangan lupa pakai kode unik ini: 
GOJEKKEIZA

Untuk pengguna baru Gojek, bisa dapat promo hingga 175K loh! Tinggal redeem kode GOJEKCAMPUS di halaman promo. Selain itu bisa juga pake kode voucher GOCARAJA & GORIDEAJA untuk promo tambahan 🤑‼️","2023-10-31 09:27:00+00:00",,,"https://pbs.twimg.com/profile_images/1688907597632749568/RN6fccpj_400x400.jpg",,,,,,,,,,,,,,,"1719284837734142023",,,,,,"https://twitter.com/lookitseja/status/1719284837734142023","@lookitseja"
,"Gojek Indonesia","https://pbs.twimg.com/media/F7LpS0WW0AA3eyr.jpg?format=jpg&name=medium",,,,,,,,"id","74",,,"Gojek lang:in","0","25","15","😱SISA 2 HARI LAGI😱

Terus pake Gojek gaes, mulai dari GoRide, GoCar, GoFood, GoSend atau GoMart buat kumpulin voucher undian berhadiah periode 2~

Kamu masih bisa menang! #PastiAdaJalan

Cara lengkapnya bisa diliat di sini:
bit.ly/BuruanPakeGojek","2023-09-29 09:08:00+00:00",,,"https://pbs.twimg.com/profile_images/1335106114610839552/sF4s4MMz_400x400.jpg","#PastiAdaJalan",,,,,,,,,,,,,,"1707683721397026849","https://bit.ly/BuruanPakeGojek",,,,,"https://twitter.com/gojekindonesia/status/1707683721397026849","@gojekindonesia"
,"Noesssssssszy","https://pbs.twimg.com/media/F9vNrnwbYAAGosR.jpg?format=jpg&name=medium",,,,,,,,"id","0",,,"Gojek lang:in","0","0","0","padahal gua pake gojek karena males nawar & patokan harga ga masuk akal, malah disuruh nawar lagi","2023-10-31 09:29:00+00:00",,,"https://pbs.twimg.com/profile_images/1697204207944867841/qGLNCr3n_400x400.jpg",,,,,,,,,,,,,,,"1719285435648889019",,,,,,"https://twitter.com/dadanoes/status/1719285435648889019","@dadanoes"
,"D. Lorelei",,,,,"@advltswiim",,,,"id","0",,,"Gojek lang:in","0","0","0","Bawa nih ujan, sumpah ikhlas ci. Bangsatttt untung belom mesen gojek.","2023-10-31 09:27:00+00:00",,,"https://pbs.twimg.com/profile_images/1696956350285451264/voSBRyvw_400x400.jpg",,,,,,,,,,,,,,,"1719284860106489983",,,,,,"https://twitter.com/ddritth/status/1719284860106489983","@ddritth"
,"Gojek Indonesia",,,,,,,,,"id","61",,,"Gojek lang:in","0","57","8","Yang cakep tuh kalau udah ga bingung lagi soal urusan pisahin trip pribadi dan reimbursement kantor, karena pake Profil Bisnis Gojek. 

Praktis tinggal download laporan perjalanannya deh.","2023-10-25 11:11:00+00:00",,,"https://pbs.twimg.com/profile_images/1335106114610839552/sF4s4MMz_400x400.jpg",,,,,,,,,,,,,,,"1717136879878025612",,,,,,"https://twitter.com/gojekindonesia/status/1717136879878025612","@gojekindonesia"
,"Gojek Indonesia","https://pbs.twimg.com/media/F7mLW73W8AAU9Gd.jpg?format=jpg&name=medium","https://pbs.twimg.com/media/F7mLXHyXcAADO-F.jpg?format=jpg&name=medium",,,,,,,"id","96",,,"Gojek lang:in","0","21","6","🎊PEMENANG UNDIAN GOJEK PERIODE 2🎊

Selamat buat kamu yang terpilih sebagai pemenang!
Cek email dari Gojek Indonesia secara berkala untuk tau cara klaim hadiahnya~

Masih akan ada kejutan dan keseruan lain dari Gojek, ditunggu, ya🥳
#PastiAdaJalan","2023-10-04 12:47:00+00:00",,,"https://pbs.twimg.com/profile_images/1335106114610839552/sF4s4MMz_400x400.jpg","#PastiAdaJalan",,,,,,,,,,,,,,"1709550765906276789",,,,,,"https://twitter.com/gojekindonesia/status/1709550765906276789","@gojekindonesia"
,"evya",,,,,"@convomfs",,,,"id","0",,,"Gojek lang:in","0","0","0","kakak kmu benernya biayain buat gojek ajalah drpd buat adek egk tau diri gini","2023-10-31 09:22:00+00:00",,,"https://pbs.twimg.com/profile_images/1527619349573701632/9gAhvsA-_400x400.jpg",,,,,,,,,,,,,,,"1719283644957921370",,,,,,"https://twitter.com/evyaayyy/status/1719283644957921370","@evyaayyy"
,"✷",,,,,"@anourdey",,,,"hr","0",,,"Gojek lang:in","0","1","0","gojek","2023-10-31 09:25:00+00:00",,,"https://pbs.twimg.com/profile_images/1717114097882595328/zJ6h4SZS_400x400.jpg",,,,,,,,,,,,,,,"1719284423202607487",,,,,,"https://twitter.com/cartnivaI/status/1719284423202607487","@cartnivaI"
,"Isna Martanti",,,,,"@kegblgnunfaedh",,,,"id","0",,,"Gojek lang:in","0","0","0","Aku waktu kemarin ke Jakarta hampir kena scam kaya gini. Aku biasa di LN pun tanpa aplikasi harga sama kaya apk. Jadi ngga ada unsur penipuan, eh tiba di tujuan ku malah harga 50k jadi minta 100k, aku kasih 50k trs aku tinggal aja tuh gojek. Sumpah ngga lg2","2023-10-31 09:26:00+00:00",,,"https://pbs.twimg.com/profile_images/1672609657981112320/gmqk69HU_400x400.jpg",,,,,,,,,,,,,,,"1719284817865654664",,,,,,"https://twitter.com/rfm_isna/status/1719284817865654664","@rfm_isna"
,"DJTech","https://pbs.twimg.com/media/F9vNrnwbYAAGosR.jpg?format=jpg&name=medium",,,,,,,,"id","0",,,"Gojek lang:in","0","0","0","Kenapa jd mundur setelah ada teknologi?
#gojek #Online","2023-10-31 09:25:00+00:00",,,"https://pbs.twimg.com/profile_images/1584373422720978944/EDYr_Mvu_400x400.jpg","#gojek","#Online",,,,,,,,,,,,,"1719284420308550017",,,,,,"https://twitter.com/dermanjanner/status/1719284420308550017","@dermanjanner"
,"FλL-D1 | Ningen (人間)",,,,,,,,,"id","2",,,"Gojek lang:in","0","4","1","WFC Mendadak 

Tgl : Rabu, 1 Nov 2023
Lokasi: Kopi Lima Detik Kemang

Menyambut temen dri Malang. Jadi buat yg mau gabung silahkan yaaa
Langsung dateng aja.

Networking dan Bersosial. Safe place buat tmen2 yaa 🙌

Bisa akses via transum tpai habis itu gojek sih 🫠","2023-10-31 09:23:00+00:00",,,"https://pbs.twimg.com/profile_images/1711331123811520512/Cl-Z7Cju_400x400.jpg",,,,,,,,,,,,,,,"1719284061926281432",,,,,,"https://twitter.com/F2aldi/status/1719284061926281432","@F2aldi"
,"라라-LaLa","https://pbs.twimg.com/media/F9s0cMraQAASDbL.jpg?format=jpg&name=medium",,,,,,,,"id","1",,,"Gojek lang:in","0","1","0","Kmren juga ngalamin dari Senen ke Cipinang,,tadinya bilang gojek g taunya Opal,,diawal harganya ngikut aplikasi 35K,,sepanjang jln oknumnya pura2 g tau jalan,,ujung2nya minta dilebihin,,tapi q omelin dan q bilang lah yg bego elo g tau jalan knp q harus byr lebi,,mau g mau 35🤣","2023-10-31 09:25:00+00:00",,,"https://pbs.twimg.com/profile_images/1697275001014218752/6Q1wxqla_400x400.jpg",,,,,,,,,,,,,,,"1719284356664234275",,,,,,"https://twitter.com/Lala_DConza/status/1719284356664234275","@Lala_DConza"
,"coffee everyday",,,,,"@kegblgnunfaedh",,,,"id","0",,,"Gojek lang:in","0","0","0","mas yg di video bilang kl dia bukan gojek, emg boleh ya make seragamnya kl bukan karyawan atau anggota tsb? kan korban jadi ngiranya ojol gojek","2023-10-31 09:09:00+00:00",,,"https://pbs.twimg.com/profile_images/1615701305833689089/qZJi_ARo_400x400.jpg",,,,,,,,,,,,,,,"1719280535716192630",,,,,,"https://twitter.com/Amanamanajasi/status/1719280535716192630","@Amanamanajasi"
,"4k4","https://pbs.twimg.com/media/F9vNrnwbYAAGosR.jpg?format=jpg&name=medium",,,,,,,,"id","0",,,"Gojek lang:in","0","1","0","Skrg klo mesan gojek cuma lihat harganya aja, pas datang cancel bang....offline ya","2023-10-31 09:12:00+00:00",,,"https://pbs.twimg.com/profile_images/1562938836883509248/Vou3eKdl_400x400.jpg",,,,,,,,,,,,,,,"1719281187490074662",,,,,,"https://twitter.com/rsafari77/status/1719281187490074662","@rsafari77"
,"☀️Kash🐰","https://pbs.twimg.com/media/F9wdxMBawAAlbxA.jpg?format=jpg&name=medium",,,,,,,,"id","0",,,"Gojek lang:in","0","0","0","Bisa2nya aku keliru order gojek ampe sini😭 wkwk","2023-10-31 09:15:00+00:00",,,"https://pbs.twimg.com/profile_images/1668581901458903040/nZ6G6Jv-_400x400.jpg",,,,,,,,,,,,,,,"1719281914652365165",,,,,,"https://twitter.com/kashivaamci/status/1719281914652365165","@kashivaamci"
,"😮",,,,,,,,,"id","0",,,"Gojek lang:in","0","0","0","mbanya jgn takut, biarin aja - abang gojek yg memberitahu hrs bodoamat kalau ketemun tinnnnnnnn di surabaya😌 skrg aku lg otw me time doain yac tp diriku lupa bawa jaket","2023-10-31 09:19:00+00:00",,,"https://pbs.twimg.com/profile_images/1553418799029706752/SezsuU-a_400x400.jpg",,,,,,,,,,,,,,,"1719282841111118255",,,,,,"https://twitter.com/aubrietacascade/status/1719282841111118255","@aubrietacascade"
,"haechan🐻",,,,,,,,,"id","0",,,"Gojek lang:in","0","0","0","makasih bapak gojek hari ini sudah ngajak aku ngobrol selama perjalanan dari kantor ke stasiun, seru banget sampe ketawa. semangat ya pak🥹🫶🏻","2023-10-31 09:19:00+00:00",,,"https://pbs.twimg.com/profile_images/1694297319745978368/uK57cPdt_400x400.jpg",,,,,,,,,,,,,,,"1719283059290505657",,,,,,"https://twitter.com/haetchanieyo/status/1719283059290505657","@haetchanieyo"
,"𝓭𝓲𝓹𝓼𝔂",,,,,"@cokelatasliii","@tanyakanrl",,,"hr","0",,,"Gojek lang:in","0","0","0","mjb itu gojek kak bukan grab","2023-10-31 09:19:00+00:00",,,"https://pbs.twimg.com/profile_images/1605918125236834304/dmwXY4kR_400x400.jpg",,,,,,,,,,,,,,,"1719282846496657681",,,,,,"https://twitter.com/nadipsyyyy/status/1719282846496657681","@nadipsyyyy"
,"jangga_513",,,,,"@kumparan",,,,"id","0",,,"Gojek lang:in","0","0","0","CEO anterin ketawa ketawa nih ..anjir cara gue akhirnya diikutin gojek","2023-10-31 09:19:00+00:00",,,"https://pbs.twimg.com/profile_images/1395277723249958916/wlic5gWc_400x400.jpg",,,,,,,,,,,,,,,"1719282947155759143",,,,,,"https://twitter.com/nadila_aning/status/1719282947155759143","@nadila_aning"
,"praying circle jadi juragan kontrakan 2030",,,,,,,,,"id","0",,,"Gojek lang:in","0","0","0","@gojekindonesia apk gojek lagi error ya?","2023-10-31 09:16:00+00:00",,,"https://pbs.twimg.com/profile_images/1719156658566463488/ZZ54sWjA_400x400.jpg",,,,,,,,,,,,,,,"1719282225672597601",,,,"gojekindonesia",,"https://twitter.com/bignaughtygirlz/status/1719282225672597601","@bignaughtygirlz"
,"Bunnybear🦋",,,,,"@kegblgnunfaedh",,,,"id","0",,,"Gojek lang:in","0","0","0","Ih pernah dulu abis pulang dari jakarta x beauty rame bgt tukang gojek yg nawarin tanpa apl, nawarinnya maksa mana matanya sambil melotot"" lagi-_-","2023-10-31 09:19:00+00:00",,,"https://pbs.twimg.com/profile_images/1714694849335820289/2e2dG7Sd_400x400.jpg",,,,,,,,,,,,,,,"1719282920718995605",,,,,,"https://twitter.com/Vantaera_/status/1719282920718995605","@Vantaera_"
,"Elang (Ekor Belang)",,,,,"@kumparan",,,,"id","1",,,"Gojek lang:in","0","0","0","Engga, alesan gua pake gojek kan krn ga suka nawarrrr, kalo gua demen nawar mah ke opang ajeee","2023-10-31 09:15:00+00:00",,,"https://pbs.twimg.com/profile_images/1210788381547909121/Qf_roZIz_400x400.jpg",,,,,,,,,,,,,,,"1719281840501215727",,,,,,"https://twitter.com/KucingKuning8/status/1719281840501215727","@KucingKuning8"
,"lela",,,,,"@amnesciaa","@DraftAnakUnpad",,,"id","8",,,"Gojek lang:in","0","0","0","di gkpn kost anabela ya, aku pesen via dm ig @/woffle.jatinangor tapi kayanya ada di gojek/grab juga -s","2023-10-31 09:07:00+00:00",,,"https://pbs.twimg.com/profile_images/1717577275733164032/KC6YGa02_400x400.jpg",,,,,,,,,,,,,,,"1719279843295273059",,,,,,"https://twitter.com/lailaapf/status/1719279843295273059","@lailaapf"
