"banner_image","fullname","images/0","images/1","images/2","images/3","in_reply_to/0","in_reply_to/1","in_reply_to/2","in_reply_to/3","language","likes","num_followers","num_following","query","quotes","replies","retweets","text","timestamp","total_likes","total_tweets","tweet_avatar","tweet_hashtags/0","tweet_hashtags/1","tweet_hashtags/2","tweet_hashtags/3","tweet_hashtags/4","tweet_hashtags/5","tweet_hashtags/6","tweet_hashtags/7","tweet_hashtags/8","tweet_hashtags/9","tweet_hashtags/10","tweet_hashtags/11","tweet_hashtags/12","tweet_hashtags/13","tweet_id","tweet_links/0","tweet_links/1","tweet_links/2","tweet_mentions/0","tweet_mentions/1","url","username"
,"JOGJA MENFESS","https://pbs.twimg.com/media/F9s8RHQbQAAZDvm.jpg?format=jpg&name=medium",,,,,,,,"id","0",,,"Gojek lang:in","0","0","0","INFO MENARIK KHUSUS ANAK KAMPUS!!🥳🥳

Untuk pengguna baru gojek dapatkan diskon total 175Rb untuk Gocar, Goride dan Gofood dengan menggunakan kode ""GOJEKCAMPUS""

yuk download gojek sekarang!
#GojekCampus #promoGojek","2023-10-31 00:00:00+00:00",,,"https://pbs.twimg.com/profile_images/1695634766127583233/klIl8cVG_400x400.jpg","#GojekCampus","#promoGojek",,,,,,,,,,,,,"1719142138259374329",,,,,,"https://twitter.com/jogmfs/status/1719142138259374329","@jogmfs"
,"Mirza Adrian",,,,,,,,,"id","3",,,"Gojek lang:in","0","0","0","Kalo mikrotrans bisa jaga headway dan nambah kapasitas, kayaknya gojek bakalan bangkrut.","2023-10-31 00:03:00+00:00",,,"https://pbs.twimg.com/profile_images/1710961551845527552/dhUKmtil_400x400.jpg",,,,,,,,,,,,,,,"1719142928294256717",,,,,,"https://twitter.com/em_er_zet/status/1719142928294256717","@em_er_zet"
,"ᮙᮂᮜᮤᮙ ᮅᮒᮛᮤ","https://pbs.twimg.com/media/F6CGGROa8AAykTi.jpg?format=jpg&name=medium",,,,,,,,"id","3",,,"Gojek lang:in","0","1","4","90% pasti kepilih lg di Dapil nya masing2~","2023-10-30 14:08:00+00:00",,,"https://pbs.twimg.com/profile_images/1697094196275150849/srbFcCbs_400x400.jpg",,,,,,,,,,,,,,,"1718993203645538577",,,,,,"https://twitter.com/Mah5Utari/status/1718993203645538577","@Mah5Utari"
,"nirwana~°",,,,,,,,,"id","0",,,"Gojek lang:in","0","0","0","masi pagi begini udah nangisin konten bapak2 ibu2 gojek  bjir😭😭","2023-10-30 23:54:00+00:00",,,"https://pbs.twimg.com/profile_images/1685959165599199232/TuYTOzln_400x400.jpg",,,,,,,,,,,,,,,"1719140762259271854",,,,,,"https://twitter.com/novitasaa_/status/1719140762259271854","@novitasaa_"
,"oioioi",,,,,,,,,"id","0",,,"Gojek lang:in","0","0","0","happy banget dapet abang gojek yang bisa ngejar jam masuk sekolah gue😋💥","2023-10-30 23:46:00+00:00",,,"https://pbs.twimg.com/profile_images/1710301906902417409/Qq10zaG3_400x400.jpg",,,,,,,,,,,,,,,"1719138835689619865",,,,,,"https://twitter.com/owiextrovert/status/1719138835689619865","@owiextrovert"
,"MFA",,,,,"@GrabID","@Hottbowls","@Heraloebss",,"id","0",,,"Gojek lang:in","0","0","0","Saham grab di bursa amerika lg nyungsep. Skr brd di angka 1.25 usd. Entar lg di suspen ama bursa amerika, sama seperti gojek.","2023-10-30 23:45:00+00:00",,,"https://pbs.twimg.com/profile_images/1669810133466226688/t0bDTnQZ_400x400.jpg",,,,,,,,,,,,,,,"1719138498756886985",,,,,,"https://twitter.com/Mfaproperti/status/1719138498756886985","@Mfaproperti"
,"DianAdrian",,,,,"@Addidiero_","@kegblgnunfaedh",,,"id","0",,,"Gojek lang:in","0","0","0","Mas gojeknya kalah debat..pake jaket gojek dia bilang aplikasinya di hpnya bukan","2023-10-30 23:46:00+00:00",,,"https://pbs.twimg.com/profile_images/1694305057922334720/QY5zv15N_400x400.png",,,,,,,,,,,,,,,"1719138618164568200",,,,,,"https://twitter.com/Dianadrian24/status/1719138618164568200","@Dianadrian24"
,"Black Arrow","https://pbs.twimg.com/media/F9q5J9XaEAAZLVK.jpg?format=jpg&name=medium","https://pbs.twimg.com/media/F9q5J9YaMAAoLfA.jpg?format=jpg&name=medium",,,,,,,"id","159",,,"Gojek lang:in","0","7","9","Helm nya malah jadi helm gojek 😂","2023-10-30 07:17:00+00:00",,,"https://pbs.twimg.com/profile_images/1590663920561229826/m46cRoD7_400x400.jpg",,,,,,,,,,,,,,,"1718889799506186370",,,,,,"https://twitter.com/Black_arrow94/status/1718889799506186370","@Black_arrow94"
,"pi • lagi sibuk banget","https://pbs.twimg.com/media/F9ueBs_agAAbceT.jpg?format=jpg&name=medium","https://pbs.twimg.com/media/F9ueCOWagAA-zW-.jpg?format=jpg&name=medium",,,"@ChentongNasie",,,,"id","0",,,"Gojek lang:in","0","1","0","udah bersama naya-gojek fttm😸","2023-10-30 23:57:00+00:00",,,"https://pbs.twimg.com/profile_images/1712643317006290944/ttBz72aX_400x400.jpg",,,,,,,,,,,,,,,"1719141451479802313",,,,,,"https://twitter.com/ChentongNasie/status/1719141451479802313","@ChentongNasie"
,"pi • lagi sibuk banget","https://pbs.twimg.com/media/F9uehEfaQAAWp-u.jpg?format=jpg&name=medium",,,,,,,,"id","0",,,"Gojek lang:in","0","3","0","naya gojek lagi isi bensin (penuh antusias)","2023-10-30 23:59:00+00:00",,,"https://pbs.twimg.com/profile_images/1712643317006290944/ttBz72aX_400x400.jpg",,,,,,,,,,,,,,,"1719141985012121743",,,,,,"https://twitter.com/ChentongNasie/status/1719141985012121743","@ChentongNasie"
,"dn",,,,,,,,,"id","0",,,"Gojek lang:in","0","1","0","yaallah sebel banget kalo naik gojek joknya licin merosot merosot terus","2023-10-30 23:58:00+00:00",,,"https://pbs.twimg.com/profile_images/1606123105017270272/LwXugHUQ_400x400.jpg",,,,,,,,,,,,,,,"1719141677502447801",,,,,,"https://twitter.com/adeenns/status/1719141677502447801","@adeenns"
,"❤🧡💛",,,,,"@worksfess",,,,"id","1",,,"Gojek lang:in","0","0","0","1. neobank bunga yg kita dpt lbh tinggi
2. kl seabank enak kl mau beli2 shopee & limit topup gratisan (gojek, ovo, atau tf bank lain) lbh byk

jd aku pake dua2nya wkwk","2023-10-31 00:06:00+00:00",,,"https://pbs.twimg.com/profile_images/1710628821966475264/LwVwKAWJ_400x400.jpg",,,,,,,,,,,,,,,"1719143653426491708",,,,,,"https://twitter.com/favbitjx/status/1719143653426491708","@favbitjx"
,"ritol",,,,,"@jembermfs",,,,"id","0",,,"Gojek lang:in","0","0","0","Ada tapi gocar agak sulit kalau weekend, kalau gojek masih ada juga sulit","2023-10-30 23:58:00+00:00",,,"https://pbs.twimg.com/profile_images/1393950668277256192/cVSi3z4D_400x400.jpg",,,,,,,,,,,,,,,"1719141803964944643",,,,,,"https://twitter.com/AfaninMariyam/status/1719141803964944643","@AfaninMariyam"
,"scallion","https://pbs.twimg.com/media/F9smMM-acAAw4_W.jpg?format=jpg&name=medium","https://pbs.twimg.com/media/F9smMiCb0AAI7Ti.jpg?format=jpg&name=medium",,,,,,,"af","0",,,"Gojek lang:in","0","0","0","Jadi driver gojek apa iklan shopeeepepepe gratis ongkir cod 🤣🤣🤣🤣","2023-10-31 00:07:00+00:00",,,"https://pbs.twimg.com/profile_images/1713532207946686464/DcKqsqNe_400x400.jpg",,,,,,,,,,,,,,,"1719143943437520911",,,,,,"https://twitter.com/vladslemon1/status/1719143943437520911","@vladslemon1"
,"JOGJA MENFESS","https://pbs.twimg.com/media/F9s8RHQbQAAZDvm.jpg?format=jpg&name=medium",,,,,,,,"id","0",,,"Gojek lang:in","0","0","0","INFO MENARIK KHUSUS ANAK KAMPUS!!🥳🥳

Untuk pengguna baru gojek dapatkan diskon total 175Rb untuk Gocar, Goride dan Gofood dengan menggunakan kode ""GOJEKCAMPUS""

yuk download gojek sekarang!
#GojekCampus #promoGojek","2023-10-31 00:00:00+00:00",,,"https://pbs.twimg.com/profile_images/1695634766127583233/klIl8cVG_400x400.jpg","#GojekCampus","#promoGojek",,,,,,,,,,,,,"1719142138259374329",,,,,,"https://twitter.com/jogmfs/status/1719142138259374329","@jogmfs"
,"Mirza Adrian",,,,,,,,,"id","3",,,"Gojek lang:in","0","0","0","Kalo mikrotrans bisa jaga headway dan nambah kapasitas, kayaknya gojek bakalan bangkrut.","2023-10-31 00:03:00+00:00",,,"https://pbs.twimg.com/profile_images/1710961551845527552/dhUKmtil_400x400.jpg",,,,,,,,,,,,,,,"1719142928294256717",,,,,,"https://twitter.com/em_er_zet/status/1719142928294256717","@em_er_zet"
,"ᮙᮂᮜᮤᮙ ᮅᮒᮛᮤ","https://pbs.twimg.com/media/F6CGGROa8AAykTi.jpg?format=jpg&name=medium",,,,,,,,"id","3",,,"Gojek lang:in","0","1","4","90% pasti kepilih lg di Dapil nya masing2~","2023-10-30 14:08:00+00:00",,,"https://pbs.twimg.com/profile_images/1697094196275150849/srbFcCbs_400x400.jpg",,,,,,,,,,,,,,,"1718993203645538577",,,,,,"https://twitter.com/Mah5Utari/status/1718993203645538577","@Mah5Utari"
,"nirwana~°",,,,,,,,,"id","0",,,"Gojek lang:in","0","0","0","masi pagi begini udah nangisin konten bapak2 ibu2 gojek  bjir😭😭","2023-10-30 23:54:00+00:00",,,"https://pbs.twimg.com/profile_images/1685959165599199232/TuYTOzln_400x400.jpg",,,,,,,,,,,,,,,"1719140762259271854",,,,,,"https://twitter.com/novitasaa_/status/1719140762259271854","@novitasaa_"
,"oioioi",,,,,,,,,"id","0",,,"Gojek lang:in","0","0","0","happy banget dapet abang gojek yang bisa ngejar jam masuk sekolah gue😋💥","2023-10-30 23:46:00+00:00",,,"https://pbs.twimg.com/profile_images/1710301906902417409/Qq10zaG3_400x400.jpg",,,,,,,,,,,,,,,"1719138835689619865",,,,,,"https://twitter.com/owiextrovert/status/1719138835689619865","@owiextrovert"
,"MFA",,,,,"@GrabID","@Hottbowls","@Heraloebss",,"id","0",,,"Gojek lang:in","0","0","0","Saham grab di bursa amerika lg nyungsep. Skr brd di angka 1.25 usd. Entar lg di suspen ama bursa amerika, sama seperti gojek.","2023-10-30 23:45:00+00:00",,,"https://pbs.twimg.com/profile_images/1669810133466226688/t0bDTnQZ_400x400.jpg",,,,,,,,,,,,,,,"1719138498756886985",,,,,,"https://twitter.com/Mfaproperti/status/1719138498756886985","@Mfaproperti"
,"DianAdrian",,,,,"@Addidiero_","@kegblgnunfaedh",,,"id","0",,,"Gojek lang:in","0","0","0","Mas gojeknya kalah debat..pake jaket gojek dia bilang aplikasinya di hpnya bukan","2023-10-30 23:46:00+00:00",,,"https://pbs.twimg.com/profile_images/1694305057922334720/QY5zv15N_400x400.png",,,,,,,,,,,,,,,"1719138618164568200",,,,,,"https://twitter.com/Dianadrian24/status/1719138618164568200","@Dianadrian24"
,"Black Arrow","https://pbs.twimg.com/media/F9q5J9XaEAAZLVK.jpg?format=jpg&name=medium","https://pbs.twimg.com/media/F9q5J9YaMAAoLfA.jpg?format=jpg&name=medium",,,,,,,"id","159",,,"Gojek lang:in","0","7","9","Helm nya malah jadi helm gojek 😂","2023-10-30 07:17:00+00:00",,,"https://pbs.twimg.com/profile_images/1590663920561229826/m46cRoD7_400x400.jpg",,,,,,,,,,,,,,,"1718889799506186370",,,,,,"https://twitter.com/Black_arrow94/status/1718889799506186370","@Black_arrow94"
,"pi • lagi sibuk banget","https://pbs.twimg.com/media/F9ueBs_agAAbceT.jpg?format=jpg&name=medium","https://pbs.twimg.com/media/F9ueCOWagAA-zW-.jpg?format=jpg&name=medium",,,"@ChentongNasie",,,,"id","0",,,"Gojek lang:in","0","1","0","udah bersama naya-gojek fttm😸","2023-10-30 23:57:00+00:00",,,"https://pbs.twimg.com/profile_images/1712643317006290944/ttBz72aX_400x400.jpg",,,,,,,,,,,,,,,"1719141451479802313",,,,,,"https://twitter.com/ChentongNasie/status/1719141451479802313","@ChentongNasie"
,"Bekasi tizen","https://pbs.twimg.com/media/F9s0cMraQAASDbL.jpg?format=jpg&name=medium",,,,,,,,"id","0",,,"Gojek lang:in","0","1","0","Cewe gw malah pesen gojek terus drivernya gojek salah ambil penumpang wtf wkwk,untung aja cewe gw baik hati kaga mau perpanjang masalah terus pesen lagi","2023-10-30 23:23:00+00:00",,,"https://pbs.twimg.com/profile_images/1576038066938007552/h0_M2xfz_400x400.jpg",,,,,,,,,,,,,,,"1719132930818424890",,,,,,"https://twitter.com/BekasiTizen/status/1719132930818424890","@BekasiTizen"
,"Paman RT",,,,,"@nusantara1928",,,,"id","0",,,"Gojek lang:in","0","1","0","aku nate mudhun soko bis dipapak tukang ojek.
""Bade ten pundi?""
""Sesuai aplikasi nggeh Pak"" sambil memperlihatkan tarif gojek ke rumah. 

100% dipek dewe.
Tapi ya jemput bola.
=))","2023-10-30 23:35:00+00:00",,,"https://pbs.twimg.com/profile_images/1668166751442579458/l_VroyZT_400x400.jpg",,,,,,,,,,,,,,,"1719135955385552974",,,,,,"https://twitter.com/pakerte/status/1719135955385552974","@pakerte"
,"nafia",,,,,,,,,"id","0",,,"Gojek lang:in","0","1","0","gojek anjg ga berkah anjg lu biarin ajh","2023-10-30 23:19:00+00:00",,,"https://pbs.twimg.com/profile_images/1718317904775753729/QauFpZfN_400x400.png",,,,,,,,,,,,,,,"1719131947174400486",,,,,,"https://twitter.com/chxsevtlntc/status/1719131947174400486","@chxsevtlntc"
,"laki laki normal",,,,,"@Heraloebss",,,,"id","0",,,"Gojek lang:in","0","0","0","Klau ada ojol kya gtu apa lgi ada video tinggal lapor ke gojeknya lapor ke polisi langsung akun gojek si ojol itu hilang dan dia ga bisa cari uang lgi","2023-10-30 23:28:00+00:00",,,"https://pbs.twimg.com/profile_images/1251067801453748224/U8NoIrqh_400x400.jpg",,,,,,,,,,,,,,,"1719134187385761933",,,,,,"https://twitter.com/Jajang1212Laki/status/1719134187385761933","@Jajang1212Laki"
,"laine","https://pbs.twimg.com/media/F9s0cMraQAASDbL.jpg?format=jpg&name=medium",,,,,,,,"id","0",,,"Gojek lang:in","0","1","0","ini lucu banget, ngaku bukan ojek atau gojek tapi mangkal dan pake atribut gojek","2023-10-30 23:42:00+00:00",,,"https://pbs.twimg.com/profile_images/1717863345926402048/BmDkaQ3n_400x400.jpg",,,,,,,,,,,,,,,"1719137678921433188",,,,,,"https://twitter.com/tengzah/status/1719137678921433188","@tengzah"
,"rifky ramadhani",,,,,"@txtdarisisange",,,,"id","2",,,"Gojek lang:in","0","0","0","Pasien jiwa kalo dikasih hape ya begini. Pihak CS Gojek tolong dianulir review bintang satu begini. Memutus rejeki orang aja","2023-10-30 23:21:00+00:00",,,"https://pbs.twimg.com/profile_images/1671592566964506624/-eri1iBJ_400x400.jpg",,,,,,,,,,,,,,,"1719132497886482792",,,,,,"https://twitter.com/rifky2014/status/1719132497886482792","@rifky2014"
,"xavie galau 🐄",,,,,,,,,"tl","0",,,"Gojek lang:in","0","6","0","gue ngapain salam ke abang gojek 😭😭","2023-10-30 23:20:00+00:00",,,"https://pbs.twimg.com/profile_images/1712141913938382848/m1UZrJl1_400x400.jpg",,,,,,,,,,,,,,,"1719132148635234704",,,,,,"https://twitter.com/urbackbburner/status/1719132148635234704","@urbackbburner"
,"billy","https://pbs.twimg.com/media/F9s0cMraQAASDbL.jpg?format=jpg&name=medium",,,,,,,,"id","0",,,"Gojek lang:in","0","1","0","Dulu pas smp pernah naik gojek buat ke sekolah buat naro rapot doang abis itu gada kerjaan lagi, ojeknya nanya ""kakaknya abis ini lgsg plg apa gimana?"" Gue jawab jujur ""iya pak"" trus disaranin ""oh yaudah nnti plgnya sama saya lagi aja, gausah dari aplikasi""","2023-10-30 23:19:00+00:00",,,"https://pbs.twimg.com/profile_images/1692904347099856896/LrEJBdld_400x400.jpg",,,,,,,,,,,,,,,"1719131827078930907",,,,,,"https://twitter.com/to__Oge/status/1719131827078930907","@to__Oge"
,"Waluyo",,,,,"@Lumiefairy",,,,"id","0",,,"Gojek lang:in","0","1","0","berarti sampean pas salting karo mas gojek e yaa nduk, mpun talah ati ati lek salting urusan mburi ae toh nduk😂","2023-10-30 23:15:00+00:00",,,"https://pbs.twimg.com/profile_images/1663218152845750272/6IGtOdhP_400x400.jpg",,,,,,,,,,,,,,,"1719130874506256533",,,,,,"https://twitter.com/waluyo99_/status/1719130874506256533","@waluyo99_"
,"c | wa fsr","https://pbs.twimg.com/media/F9uWKIxagAAtWtl.jpg?format=jpg&name=medium",,,,,,,,"nl","0",,,"Gojek lang:in","0","0","0","wts voc voucher gojek

🍔gofood fee 4k
- minbel 40k
-  gf+✅ 

boleh cek dulu

wa.me/+62085161041616
#zonauang #zonajajan","2023-10-30 23:22:00+00:00",,,"https://pbs.twimg.com/profile_images/1656496210042318848/aMExBZku_400x400.jpg","#zonauang","#zonajajan",,,,,,,,,,,,,"1719132786936905782","https://wa.me/+62085161041616",,,,,"https://twitter.com/andyourcas/status/1719132786936905782","@andyourcas"
,"ddmeit",,,,,"@Chroomatic","@tarlagikaya","@kegblgnunfaedh",,"id","0",,,"Gojek lang:in","0","0","0","Gimana dah, kan legal kita bikin perjanjian asal tidak melanggar hukum, aturan gojek ngga mwngikat, kalo mbanya punya asuransi ya pasti ada tp bukan Dr gojek. Ini drivernya wanprestasi.","2023-10-30 23:06:00+00:00",,,"https://pbs.twimg.com/profile_images/1609413923979288578/d-PecliF_400x400.jpg",,,,,,,,,,,,,,,"1719128709406564376",,,,,,"https://twitter.com/jinjaneo/status/1719128709406564376","@jinjaneo"
,"yakul",,,,,,,,,"id","323",,,"Gojek lang:in","18","0","78","youngk nih gue rasa tipe yang ngajak ngobrol SEMUA ORANG, kita2 kalo naik gojek pengennya diem2an ini malah dia yg ngajak ngobrol drivernya. pacarnya nyalon, dia nunggu di parkiran sambil ngajak ngobrol tukang parkirnya (bukan dia yang nyetir)","2023-10-29 14:17:00+00:00",,,"https://pbs.twimg.com/profile_images/1718463762070720512/_cxaaz0m_400x400.jpg",,,,,,,,,,,,,,,"1718633117462696082",,,,,,"https://twitter.com/akunyakul/status/1718633117462696082","@akunyakul"
,"ucel",,,,,,,,,"id","1",,,"Gojek lang:in","0","0","0","pagi ini gua dijemput abang gojek, udah beberapa kali dapet sama dia, eh td pagi dia bukain pijekan penumpang trus pas gua naik dia nanya ""mau pegangan mas?"", gua yg kaya apa kita nikah aja mas? akwoakowkok","2023-10-30 23:00:00+00:00",,,"https://pbs.twimg.com/profile_images/1713748736365809664/uqkltgTg_400x400.jpg",,,,,,,,,,,,,,,"1719127092984762464",,,,,,"https://twitter.com/jelambarr/status/1719127092984762464","@jelambarr"
,"sky.",,,,,"@cyeroaja",,,,"id","0",,,"Gojek lang:in","0","0","0","aku pke maxim klo udh kepepet sih ro, sering gojek sama in drive. anw thank u reminder nya!","2023-10-30 22:55:00+00:00",,,"https://pbs.twimg.com/profile_images/1718973631605411840/PQY0iX-7_400x400.jpg",,,,,,,,,,,,,,,"1719125976473645493",,,,,,"https://twitter.com/introuverd/status/1719125976473645493","@introuverd"
,"rara²",,,,,"@convomfs",,,,"id","0",,,"Gojek lang:in","0","0","0","eh ada gojek anjg, minta duit ama orang tua lu lah jangan jadi beban anak orang","2023-10-30 22:54:00+00:00",,,"https://pbs.twimg.com/profile_images/1716113428153266176/ItrRW_jJ_400x400.jpg",,,,,,,,,,,,,,,"1719125771112054793",,,,,,"https://twitter.com/helooje/status/1719125771112054793","@helooje"
,"Aru",,,,,,,,,"id","0",,,"Gojek lang:in","0","0","0","suka sebel kalau dapet driver gojek yang sotoy.. dikasih arahan biar cepet malah sok ngide, aduh 😰","2023-10-30 22:51:00+00:00",,,"https://pbs.twimg.com/profile_images/1717916634915172353/MrNoMTfr_400x400.jpg",,,,,,,,,,,,,,,"1719124882603282658",,,,,,"https://twitter.com/arunistar/status/1719124882603282658","@arunistar"
,"Fernando 🐻🖤",,,,,"@tanyakanrl",,,,"id","0",,,"Gojek lang:in","0","0","0","Bisa gw sering pesenin grab / gojek buat tim kerja gw yg di semarang tinggal pilih alamat penjemputan dan alamat tujuan disana. Trs ksh nomor penumpang nder biar kita yg mesenin ga di terror abgnya perihal posisinya dmn","2023-10-30 22:56:00+00:00",,,"https://pbs.twimg.com/profile_images/1629136389928521728/HykCbR8v_400x400.jpg",,,,,,,,,,,,,,,"1719126116420784593",,,,,,"https://twitter.com/wemutt_/status/1719126116420784593","@wemutt_"
,"JOGJA MENFESS","https://pbs.twimg.com/media/F9PoAAGaAAA4F-p.jpg?format=jpg&name=medium","https://pbs.twimg.com/media/F9PoAA_bUAAmBcL.jpg?format=jpg&name=medium",,,,,,,"id","2",,,"Gojek lang:in","0","0","0","Daftar kode promo Gojek minggu ini :

- GORIDEAJA & GOCARAJA - Diskon sd 60k
- GOBANDARA - Diskon dari/ke Bandara sd 140k

Km jg bisa Cek Halaman Promo di apps Gojek kamu utk tau voucher apa aja yg Km punya. Gasskeun!","2023-10-30 23:00:00+00:00",,,"https://pbs.twimg.com/profile_images/1695634766127583233/klIl8cVG_400x400.jpg",,,,,,,,,,,,,,,"1719127040044269703",,,,,,"https://twitter.com/jogmfs/status/1719127040044269703","@jogmfs"
,"toya",,,,,"@convomfs",,,,"id","0",,,"Gojek lang:in","0","0","0","Se ngga punya uang itu buat jajan sama gojek?? Kasian bgt nder buat gtu aja sampe manfaatin org, semoga cepet putus deh kasian pasangan lo itu","2023-10-30 22:55:00+00:00",,,"https://pbs.twimg.com/profile_images/1679707196114997251/YmqZVWrT_400x400.jpg",,,,,,,,,,,,,,,"1719125982362345699",,,,,,"https://twitter.com/toyanyacaca/status/1719125982362345699","@toyanyacaca"
,"Jilan",,,,,,,,,"id","0",,,"Gojek lang:in","0","0","0","Pake ID, Gojek, Grab, Maxim, angkot. Kl gak mau jg, yaudah ke temen. Kl gak enak, yaudah belajar mandiri, apa2 pergi sendiri, kecuali kl gak diizinin ortu naik ojol sendirian, ya nurut sm ortu","2023-10-30 22:32:00+00:00",,,"https://pbs.twimg.com/profile_images/1718576144835076097/1yRBFY6l_400x400.jpg",,,,,,,,,,,,,,,"1719120190649315564",,,,,,"https://twitter.com/tatakjil/status/1719120190649315564","@tatakjil"
,"Lukman_Nusantara",,,,,,,,,"id","1",,,"Gojek lang:in","0","1","0","dari kacamataku yg awam iki
potongan 35%
bensin dn segala kerusakam motor tanggung jwb pribadi
ngono panggah rugi ki sakjane ngelolae piye jek gojek iki","2023-10-30 22:43:00+00:00",,,"https://pbs.twimg.com/profile_images/1716585454202675200/C3uwfaCp_400x400.jpg",,,,,,,,,,,,,,,"1719122808620699982",,,,,,"https://twitter.com/nusantara1928/status/1719122808620699982","@nusantara1928"
,"sandixxx94",,,,,"@kegblgnunfaedh",,,,"id","0",,,"Gojek lang:in","0","0","0","Alamat di suspen gojek tuh...","2023-10-30 22:42:00+00:00",,,"https://pbs.twimg.com/profile_images/986189679677489152/ZUdHDGJc_400x400.jpg",,,,,,,,,,,,,,,"1719122716824129603",,,,,,"https://twitter.com/sandixxx941/status/1719122716824129603","@sandixxx941"
,"jualan si handal | fsr wa | @ aftr dm yah! | kn sb",,,,,,,,,"id","0",,,"Gojek lang:in","0","8","0","nokos untuk gojek yang murmer dongg #zonauang #zonajajan","2023-10-30 22:40:00+00:00",,,"https://pbs.twimg.com/profile_images/1316976591847579648/M1fpEiUY_400x400.jpg","#zonauang","#zonajajan",,,,,,,,,,,,,"1719122125053899225",,,,,,"https://twitter.com/pemainhandals/status/1719122125053899225","@pemainhandals"
,"jasa CV ATS friendly – CV kreatif – cover letter","https://pbs.twimg.com/media/F9uNYDMa4AAlOV8.jpg?format=jpg&name=medium",,,,,,,,"en","0",,,"Gojek lang:in","0","0","0","OPEN🤗
menerima jasa bikin CV ATS friendly, CV kreatif, cover letter, & buat surat lamaran. CV tembus itv user HMS, Shopee, Tokped, Gojek, Grab, Warpin, Unilever, P&G, dll
contoh porto, 2100+ testi cek IG: instagram.com/jasa_cv_ats
WA: wa.me/6281383839873
#jasacvats #jokitugas","2023-10-30 22:44:00+00:00",,,"https://pbs.twimg.com/profile_images/1682207546432696320/aQn8j7kI_400x400.jpg","#jasacvats","#jokitugas",,,,,,,,,,,,,"1719123133091967314","https://instagram.com/jasa_cv_ats","https://wa.me/6281383839873",,,,"https://twitter.com/jasa_cv_ats/status/1719123133091967314","@jasa_cv_ats"
,"zara || road to 1st single paul",,,,,,,,,"id","1439",,,"Gojek lang:in","31","10","549","nangisin ini ga berhenti. beneran ga sampe hati ngebayangin mereka gabisa tidur, makan, minum dan selalu dalam keadaan waswas dibom. anak anak dan org tuanya yg saling dipisahkan oleh maut hey seberapa banyak lg nyawa yg mau kalian pertaruhkan????!!!!!! 
#FreePalestine","2023-10-30 04:34:00+00:00",,,"https://pbs.twimg.com/profile_images/1711362905420288000/q1Rbh4OB_400x400.jpg","#FreePalestine",,,,,,,,,,,,,,"1718848891486195942",,,,,,"https://twitter.com/univerzahll/status/1718848891486195942","@univerzahll"
,"celcius","https://pbs.twimg.com/media/F8yv4M2bcAAPfKL.jpg?format=jpg&name=medium","https://pbs.twimg.com/media/F8yv4YRa0AAzUMX.jpg?format=jpg&name=medium","https://pbs.twimg.com/media/F8yv4k6akAAkb50.jpg?format=jpg&name=medium",,,,,,"id","1831",,,"Gojek lang:in","24","1","452","#sugusato #jjk short au — perihal satoru yang jadi jobseeker berbulan-bulan, eh malah ketemu abang gojek yang ternyata doi USER di perusahaan besar.","2023-10-19 09:38:00+00:00",,,"https://pbs.twimg.com/profile_images/1716144556973146112/ahBuiZtC_400x400.jpg","#sugusato","#jjk",,,,,,,,,,,,,"1714938947170930991",,,,,,"https://twitter.com/cweathere/status/1714938947170930991","@cweathere"
,"wts skintific somethinc npure luxcrime azarine",,,,,"@matcimalate","@berburusales",,,"hr","0",,,"Gojek lang:in","0","1","0","Aku di open gojek gt kak, gojek agak santai krn nom gede sih😁","2023-10-30 22:23:00+00:00",,,"https://pbs.twimg.com/profile_images/1507000777042137094/K13PSsce_400x400.jpg",,,,,,,,,,,,,,,"1719117857597030772",,,,,,"https://twitter.com/bigwinyook/status/1719117857597030772","@bigwinyook"
,"yoo.",,,,,"@kegblgnunfaedh",,,,"id","0",,,"Gojek lang:in","0","0","0","@gojekindonesia usut nii oknumnya udh beberapa klii meres org, entah dia karyawan gojek/bukan tp jaketnya dr perusahaan anda","2023-10-30 22:21:00+00:00",,,"https://pbs.twimg.com/profile_images/1656491214261350400/5HTEse4T_400x400.jpg",,,,,,,,,,,,,,,"1719117398559842478",,,,"gojekindonesia",,"https://twitter.com/juztyoo/status/1719117398559842478","@juztyoo"
,"pute̸e̸e̸🐊","https://pbs.twimg.com/media/F9uEfvRaQAA2Vke.jpg?format=jpg&name=medium",,,,,,,,"id","2",,,"Gojek lang:in","0","0","0","niat pulang cepet, ada aja titipan wkwk. dahlah cosplay jadi kang gojek aja 😌","2023-10-30 22:05:00+00:00",,,"https://pbs.twimg.com/profile_images/1719009603294523392/KuaXaY8f_400x400.jpg",,,,,,,,,,,,,,,"1719113367573680576",,,,,,"https://twitter.com/bukanakdajjal/status/1719113367573680576","@bukanakdajjal"
,"Pecinta Suguru",,,,,,,,,"id","1",,,"Gojek lang:in","0","1","1","Siapapun tolong kasih tahu gw sugusato au yang satoru jobseeker, terus suguru user perusahaan. Terus mereka ketemu pas satoru mau keliling2, naik gojek gitu, suguru  abang ojolnya, terus di traktir starbak. Plis plis plis, info dong. 😫","2023-10-24 12:28:00+00:00",,,"https://pbs.twimg.com/profile_images/1713201534186762240/T6KqbMYf_400x400.jpg",,,,,,,,,,,,,,,"1716793823840604323",,,,,,"https://twitter.com/meonglagicape/status/1716793823840604323","@meonglagicape"
,"Random World War",,,,,,,,,"id","17258",,,"Gojek lang:in","341","358","5595","Israel melakukan kejahatan perang lagi saat menembak mobil yang dikendarai oleh warga sipil di Gaza, Palestina! Terlihat mobil yang sedang memutar balik (mungkin karena salah arah, ketakutan saat melihat tank Israel), tiba-tiba saja dihantam dengan meriam tank Merkava kal 120mm!","2023-10-30 12:35:00+00:00",,,"https://pbs.twimg.com/profile_images/1469495885545422851/qoRY9ffM_400x400.jpg",,,,,,,,,,,,,,,"1718969763601486049",,,,,,"https://twitter.com/RandomWorldWar/status/1718969763601486049","@RandomWorldWar"
