"banner_image","fullname","images/0","images/1","images/2","images/3","in_reply_to/0","in_reply_to/1","in_reply_to/2","in_reply_to/3","language","likes","num_followers","num_following","query","quotes","replies","retweets","text","timestamp","total_likes","total_tweets","tweet_avatar","tweet_hashtags/0","tweet_hashtags/1","tweet_hashtags/2","tweet_hashtags/3","tweet_hashtags/4","tweet_hashtags/5","tweet_hashtags/6","tweet_hashtags/7","tweet_hashtags/8","tweet_hashtags/9","tweet_hashtags/10","tweet_hashtags/11","tweet_hashtags/12","tweet_hashtags/13","tweet_id","tweet_links/0","tweet_links/1","tweet_links/2","tweet_mentions/0","tweet_mentions/1","url","username"
,"Bisnis.com",,,,,,,,,"id","0",,,"Gojek lang:in","0","0","0","Ini Perbedaan Fitur Negosiasi Harga di Gojek vs inDrive teknologi.bisnis.com/read/20…","2023-10-31 05:23:00+00:00",,,"https://pbs.twimg.com/profile_images/1598573955513692160/leorpOyo_400x400.jpg",,,,,,,,,,,,,,,"1719223450714386726","https://teknologi.bisnis.com/read/20231031/266/1709619/ini-perbedaan-fitur-negosiasi-harga-di-gojek-vs-indrive?utm_source=dlvr.it&utm_medium=twitter",,,,,"https://twitter.com/Bisniscom/status/1719223450714386726","@Bisniscom"
,"Be the Apple of God's eye👁",,,,,"@IdApaajah","@kumparan",,,"id","0",,,"Gojek lang:in","0","1","0","Ngeri kalo bagi hasil nya 20%, kalo pedagang kaki lima bagi hasil 20% wajar pengganti sewa lapak, gojek mah  yg kaya pemegang saham nya","2023-10-31 05:21:00+00:00",,,"https://pbs.twimg.com/profile_images/1677674739530362881/musNKair_400x400.jpg",,,,,,,,,,,,,,,"1719223120031273101",,,,,,"https://twitter.com/elleanor12/status/1719223120031273101","@elleanor12"
,"Rizky Maulana",,,,,"@ttirusaru","@kumparan",,,"id","0",,,"Gojek lang:in","0","0","0","Gojek mulai nyungsep ⬇️⬇️⬇️","2023-10-31 05:14:00+00:00",,,"https://pbs.twimg.com/profile_images/1707474516266647554/KGrNOtKQ_400x400.png",,,,,,,,,,,,,,,"1719221162318913580",,,,,,"https://twitter.com/RMaulana99982/status/1719221162318913580","@RMaulana99982"
,"Lilicery",,,,,"@juwlpi",,,,"id","0",,,"Gojek lang:in","0","2","0","Ice gw ga pernah ke sana bjirr. Tpi ice Deket rumah pakdeh w di Tanggerang tpi gapernah ke sanaa sowry. Tpi katanya bisa naik KRL. 

Kalau dri Bekasi ke GBK bisa naik KRL ke St palmerah nnti nyambung entah Transjakarta atau grab gojek. Atau naik mrt tpi gatau nama St nya","2023-10-31 05:19:00+00:00",,,"https://pbs.twimg.com/profile_images/1716466810122596352/1A8Hk2vW_400x400.jpg",,,,,,,,,,,,,,,"1719222617721422064",,,,,,"https://twitter.com/henchanted23/status/1719222617721422064","@henchanted23"
,"kasih tau gak ya",,,,,"@jogmfs",,,,"id","2",,,"Gojek lang:in","0","0","0","Bisa pakai tiga cara nder : 
1. E-money / flazz 
2. Kartu kmt commuter line
3. Gotransit via app gojek","2023-10-31 05:22:00+00:00",,,"https://pbs.twimg.com/profile_images/1558782890137100288/DRegyvHl_400x400.jpg",,,,,,,,,,,,,,,"1719223178453762478",,,,,,"https://twitter.com/cieeekepoyaaa98/status/1719223178453762478","@cieeekepoyaaa98"
,"x",,,,,,,,,"id","0",,,"Gojek lang:in","0","0","0","pindah gda masih ada waktu temen gue gak dapet gojek waktu itu sampe jalan kaki dulu ajgggggg nyampe jiexpo WKWKWKWKK","2023-10-31 05:09:00+00:00",,,"https://pbs.twimg.com/profile_images/1719262736969076736/T6qOAEif_400x400.jpg",,,,,,,,,,,,,,,"1719220091198509384",,,,,,"https://twitter.com/baesuzix/status/1719220091198509384","@baesuzix"
,"∞",,,,,"@AkunApple1","@tvindonesiawkwk",,,"id","0",,,"Gojek lang:in","0","0","0","kayaknya itu bisa buat delivery deh, tapi pesennya dri aplikasi mcd nya bukan gojek","2023-10-31 05:13:00+00:00",,,"https://pbs.twimg.com/profile_images/1700174921438285824/nXAPmOkS_400x400.jpg",,,,,,,,,,,,,,,"1719221151719907498",,,,,,"https://twitter.com/diarylostgurl/status/1719221151719907498","@diarylostgurl"
,"The Mondy Monky 🇵🇸",,,,,"@YantoTerop","@jembermfs",,,"id","0",,,"Gojek lang:in","0","1","0","Sebenere demo ojol tadi itu memperjuangkan tarif ojol iku dewe (gojek).
Para driver memperjuangkan kenaikan tarif di wilayah jember.
Karena di jember gak ada kantor gojek, maka demo diarahkan ke gedung pemerintahan agar supaya bisa dsampaikan ke pihak gojek.","2023-10-31 05:14:00+00:00",,,"https://pbs.twimg.com/profile_images/1658781540837658624/iotp9koa_400x400.jpg",,,,,,,,,,,,,,,"1719221297237078029",,,,,,"https://twitter.com/romeoagresif/status/1719221297237078029","@romeoagresif"
,"laler",,,,,"@solinasoli",,,,"sl","0",,,"Gojek lang:in","0","1","0","gojek kah kita","2023-10-31 05:07:00+00:00",,,"https://pbs.twimg.com/profile_images/1669269087644700672/EOBOhVLP_400x400.jpg",,,,,,,,,,,,,,,"1719219605145842074",,,,,,"https://twitter.com/suchagrouch/status/1719219605145842074","@suchagrouch"
,"Berita DIY","https://pbs.twimg.com/media/F9vn0LjbIAA3MUO.jpg?format=jpg&name=medium","https://pbs.twimg.com/media/F9vn1cya4AAS9Mp.jpg?format=jpg&name=medium","https://pbs.twimg.com/media/F9vn2TDbYAAYAYc.jpg?format=jpg&name=medium",,,,,,"id","0",,,"Gojek lang:in","0","0","0","Bagaimana menurut kalian tentang GoRide Nego yang memungkinkan penumpang bisa tawar menawar tarif Gojek, apakah efektif?

Atau justru membuat semakin ribet? Komentar di bawah ya

#gojek #goride #goridenego #goto #tawar #ditawar #tarifgojekbisaditawar #beritahariini","2023-10-31 05:19:00+00:00",,,"https://pbs.twimg.com/profile_images/1550398223428493318/T89TyvQI_400x400.jpg","#gojek","#goride","#goridenego","#goto","#tawar","#ditawar","#tarifgojekbisaditawar","#beritahariini",,,,,,,"1719222645630402894",,,,,,"https://twitter.com/berita_diy/status/1719222645630402894","@berita_diy"
,"Gojek Driver",,,,,,,,,"id","0",,,"Gojek lang:in","0","0","0","Sosok Sertu Estarina Aritonang yang Disorot Pose Bareng Jenderal Dudung, Istri Prajurit Kopassus
 
surabaya.tribunnews.com/2023… via @tribunnews","2023-10-31 05:18:00+00:00",,,"https://pbs.twimg.com/profile_images/1675058629886763008/UI0WL7Ou_400x400.jpg",,,,,,,,,,,,,,,"1719222229916061993","https://surabaya.tribunnews.com/2023/10/30/sosok-sertu-estarina-aritonang-yang-disorot-pose-bareng-jenderal-dudung-istri-prajurit-kopassus",,,"tribunnews",,"https://twitter.com/d39862/status/1719222229916061993","@d39862"
,"🧚‍♀️",,,,,"@kegblgnunfaedh",,,,"id","0",,,"Gojek lang:in","0","0","0","Makanya kalo habis konser gitu ga oernah naik gojek, krn banyak oknum emang di sekitar sudirman wkwk. Lebih pilih naik mrt/krl terus dri st kerumah kalo naik gojek titik jemputnya agak jauhan biar ga ada drama gini 🥲","2023-10-31 05:11:00+00:00",,,"https://pbs.twimg.com/profile_images/1705233867618287616/2EQ6P-Tv_400x400.jpg",,,,,,,,,,,,,,,"1719220552152519004",,,,,,"https://twitter.com/matchaolic/status/1719220552152519004","@matchaolic"
,"puntdue",,,,,,,,,"en","0",,,"Gojek lang:in","0","0","0","BAPAK GOJEK CEPATLAH SAMPAI PLS","2023-10-31 05:06:00+00:00",,,"https://pbs.twimg.com/profile_images/1715024311646662656/ZVVr99KP_400x400.jpg",,,,,,,,,,,,,,,"1719219376904360332",,,,,,"https://twitter.com/datetofux_/status/1719219376904360332","@datetofux_"
,"anisa⁷ 🌷 — wts pc tae ly eu","https://pbs.twimg.com/media/F9vkgIIbwAAuIkC.jpg?format=jpg&name=medium",,,,,,,,"nl","0",,,"Gojek lang:in","0","0","0","wts wtb voc voucher gojek grab jabodetabek bandung

- goride pot 5k fee 1k

✅ chat wa di bio ya!

#zonajajan #zonauang #zonaba #zonaBU","2023-10-31 05:05:00+00:00",,,"https://pbs.twimg.com/profile_images/1696176507570249728/S2kOq_tT_400x400.jpg","#zonajajan","#zonauang","#zonaba","#zonaBU",,,,,,,,,,,"1719218927425986787",,,,,,"https://twitter.com/taexggukiie/status/1719218927425986787","@taexggukiie"
,"abe",,,,,"@convomf",,,,"id","0",,,"Gojek lang:in","0","0","0","Engga, dia gk pnya apk gojek jd kalo aku mau makan sesuatu dia langsung ayo ayo aja","2023-10-31 04:57:00+00:00",,,"https://pbs.twimg.com/profile_images/1448259693181210631/Q3H3f40-_400x400.jpg",,,,,,,,,,,,,,,"1719217109904077125",,,,,,"https://twitter.com/pembellaan/status/1719217109904077125","@pembellaan"
,"winterandsummer_20","https://pbs.twimg.com/media/F9vj1L3bsAAp03l.jpg?format=jpg&name=medium",,,,,,,,"id","0",,,"Gojek lang:in","0","0","0","Berpapasan dengan ini, aku dan bapak gojek sepakat berucap ""gemes bgt mobilnya!!"" 🤏🏻😗","2023-10-31 05:02:00+00:00",,,"https://pbs.twimg.com/profile_images/1680555089159929857/15fQm9ka_400x400.jpg",,,,,,,,,,,,,,,"1719218188108677202",,,,,,"https://twitter.com/snisaadlina/status/1719218188108677202","@snisaadlina"
,"ciaa","https://pbs.twimg.com/media/F9vjVULaAAAiNXR.jpg?format=jpg&name=medium",,,,,,,,"de","0",,,"Gojek lang:in","1","2","0","JIR AKU DIBONCENG ABANG GOJEK MOTOR MATIC MODIF KNALPOT MBER MBERRRR😔😔😔","2023-10-31 05:00:00+00:00",,,"https://pbs.twimg.com/profile_images/1710298954196258817/cLGvlR3a_400x400.jpg",,,,,,,,,,,,,,,"1719217647978692900",,,,,,"https://twitter.com/raedvls/status/1719217647978692900","@raedvls"
,"🍐",,,,,,,,,"id","0",,,"Gojek lang:in","0","1","0","bangun tidur langsung buka gojek buat scroll gofooddd","2023-10-31 05:05:00+00:00",,,"https://pbs.twimg.com/profile_images/1703981588491755521/wcv37WGh_400x400.jpg",,,,,,,,,,,,,,,"1719218921851772996",,,,,,"https://twitter.com/nichakuuu/status/1719218921851772996","@nichakuuu"
,"Stanleey Hrt",,,,,"@memelord_666666",,,,"id","41",,,"Gojek lang:in","0","0","0","Mcd ntar kalo collab sm Bts part 2 kali ini dapet photocard member juga palingab rame lagi dengan para gojek~~","2023-10-31 05:00:00+00:00",,,"https://pbs.twimg.com/profile_images/1619196206055571456/Oa-IkJmN_400x400.jpg",,,,,,,,,,,,,,,"1719217779910541670",,,,,,"https://twitter.com/stnsooyaaa_/status/1719217779910541670","@stnsooyaaa_"
,"cimol♡̆̈ close order",,,,,,,,,"id","0",,,"Gojek lang:in","0","0","0","FYI, di jalan RE martadinata alias jalanan super macet itu agak sedikit riskan jd buat yang naik kendaraan umum gojek grab hati-hati ya. Karena rame rawan bgt pencopet. Sekarang Halte Busway JIS udh bagus sih semoga shelternya nyediain banyak bus nya ya 🫶🏻 staysafe","2023-10-31 05:00:00+00:00",,,"https://pbs.twimg.com/profile_images/1713069776002764800/bxS8-E23_400x400.jpg",,,,,,,,,,,,,,,"1719217713497931867",,,,,,"https://twitter.com/sangpremacy/status/1719217713497931867","@sangpremacy"
,"RERE 🍉","https://pbs.twimg.com/media/F9vhHwtacAAExx4.jpg?format=jpg&name=medium",,,,"@jogmfs",,,,"id","3",,,"Gojek lang:in","0","1","0","Pake gotransit yg ada di gojek cuma 8rb, terus ntar discan","2023-10-31 04:50:00+00:00",,,"https://pbs.twimg.com/profile_images/1716090084540448768/2NKR-pii_400x400.jpg",,,,,,,,,,,,,,,"1719215212157669797",,,,,,"https://twitter.com/_Xorere/status/1719215212157669797","@_Xorere"
,"Brilliant D",,,,,"@kegblgnunfaedh",,,,"id","0",,,"Gojek lang:in","0","0","0","@gojekindonesia gimana ini? Cuma pakai jaket gojek atau beneran mitra?","2023-10-31 04:50:00+00:00",,,"https://abs.twimg.com/sticky/default_profile_images/default_profile_400x400.png",,,,,,,,,,,,,,,"1719215176682266980",,,,"gojekindonesia",,"https://twitter.com/BrilliantD4/status/1719215176682266980","@BrilliantD4"
,"IP","https://pbs.twimg.com/media/F9s0cMraQAASDbL.jpg?format=jpg&name=medium",,,,,,,,"id","0",,,"Gojek lang:in","0","0","0","mo daftar gojek susahnya minta ampun, tp drivernya ada aja yg bermasalah. ganti gw aja lah sini mayan buat sampingan @gojekindonesia 🗿","2023-10-31 04:50:00+00:00",,,"https://pbs.twimg.com/profile_images/1719040591001210880/evURiiY0_400x400.jpg",,,,,,,,,,,,,,,"1719215136530104498",,,,"gojekindonesia",,"https://twitter.com/chaevyans/status/1719215136530104498","@chaevyans"
,"Ulil🐯","https://pbs.twimg.com/media/F9vhjQRaIAA_Ibl.jpg?format=jpg&name=medium",,,,,,,,"id","0",,,"Gojek lang:in","0","1","0","najis bgt tsel w gak ada jaringan + gojek w error.
w lagi mesen makan astagaaaa","2023-10-31 04:52:00+00:00",,,"https://pbs.twimg.com/profile_images/1678733097851047938/TLl2_PNA_400x400.jpg",,,,,,,,,,,,,,,"1719215696863998186",,,,,,"https://twitter.com/ulililala/status/1719215696863998186","@ulililala"
,"Pradikta",,,,,"@jogmfs",,,,"id","0",,,"Gojek lang:in","0","1","0","pake gojek engga ribet tapi harus naik dan turun sesuai sama stasiun yang kamu pilih di gojeknya. gabisa asal turun.","2023-10-31 04:49:00+00:00",,,"https://pbs.twimg.com/profile_images/1619178309920911362/3Y7JJUiI_400x400.jpg",,,,,,,,,,,,,,,"1719214947979428195",,,,,,"https://twitter.com/dckywsn/status/1719214947979428195","@dckywsn"
,"-","https://pbs.twimg.com/media/F9vgQ1cbsAA3Q98.jpg?format=jpg&name=medium","https://pbs.twimg.com/media/F9vgQ1ZbAAEe1fH.jpg?format=jpg&name=medium",,,,,,,"hr","0",,,"Gojek lang:in","0","0","0","Unpopular opinions helm gojek bikin cakep","2023-10-31 04:46:00+00:00",,,"https://pbs.twimg.com/profile_images/1663049960357789696/UEfVdVSW_400x400.jpg",,,,,,,,,,,,,,,"1719214276731388036",,,,,,"https://twitter.com/matcha_yaya/status/1719214276731388036","@matcha_yaya"
,"yOyO🌻",,,,,"@Luitugakdiajak",,,,"id","0",,,"Gojek lang:in","0","1","0","Ih kok lucu birubiru, app apa itu._. Gojek udh begini kah?","2023-10-31 04:48:00+00:00",,,"https://pbs.twimg.com/profile_images/1713940355631251456/O9dC3CEh_400x400.jpg",,,,,,,,,,,,,,,"1719214741879742778",,,,,,"https://twitter.com/kucircoklat/status/1719214741879742778","@kucircoklat"
,"Youngones","https://pbs.twimg.com/media/F9s0cMraQAASDbL.jpg?format=jpg&name=medium",,,,,,,,"id","0",,,"Gojek lang:in","0","0","0","Ini mah sengaja, berlagak spt gojek pake atribut gojek tp sebenernya opang. Awalnya ga buka harga nganterin eh tar di palak aja tb2 50k. Pengalamab bgt ya sis @LLEEJEN0","2023-10-31 04:48:00+00:00",,,"https://pbs.twimg.com/profile_images/1705283855580803072/1uIktjsF_400x400.jpg",,,,,,,,,,,,,,,"1719214848926745016",,,,"LLEEJEN0",,"https://twitter.com/iamayoungones/status/1719214848926745016","@iamayoungones"
,"ara⁷",,,,,"@luluintheloo",,,,"id","0",,,"Gojek lang:in","0","1","0","pas akses masuk gatenya yaa aku ga gmn2, yang aku lebih komplainin akses buat ke jis-nya dan itu kan deket pemukiman warga gt yaa. macetnya jadi parah bgtt sampe aku harus naik gojek lewatin gang2 kecil biar cepet sampe :(","2023-10-31 04:44:00+00:00",,,"https://pbs.twimg.com/profile_images/1701206462918492160/JIsjwCsr_400x400.jpg",,,,,,,,,,,,,,,"1719213676417487337",,,,,,"https://twitter.com/namuable/status/1719213676417487337","@namuable"
,"Ninin🦖",,,,,,,,,"id","1",,,"Gojek lang:in","0","1","0","Papaku emg gatau ya disaat yg lain nyuruh aku belajar motor dan aku jg pengen bawa sendiri blio malah ""gausah ada gojek. Gojek aja"" terkesan tidak ingin saya bawa kendaraan begitulo 🙂🙂","2023-10-31 04:44:00+00:00",,,"https://pbs.twimg.com/profile_images/1699677739274686464/dvBgVt25_400x400.jpg",,,,,,,,,,,,,,,"1719213681765122260",,,,,,"https://twitter.com/anidablue/status/1719213681765122260","@anidablue"
,"Ale.grya",,,,,"@jogmfs",,,,"id","0",,,"Gojek lang:in","0","0","0","Kalo aku solo jogja naik krl pake gojek kak.. atau ga dari aplikasi KAI ada. Pesen online aja biar ga ribet","2023-10-31 04:47:00+00:00",,,"https://pbs.twimg.com/profile_images/1559955623260745731/LiyS2Yiy_400x400.jpg",,,,,,,,,,,,,,,"1719214422185615638",,,,,,"https://twitter.com/AllegryaAs/status/1719214422185615638","@AllegryaAs"
,"ve",,,,,"@jogmfs",,,,"id","1",,,"Gojek lang:in","0","0","0","pake kartu nder, ntr isi saldo. atau ga pesen pake gojek aja","2023-10-31 04:46:00+00:00",,,"https://pbs.twimg.com/profile_images/1713077894325657600/4811FaEq_400x400.jpg",,,,,,,,,,,,,,,"1719214311304994981",,,,,,"https://twitter.com/vnllltee/status/1719214311304994981","@vnllltee"
,"Kentang.",,,,,"@kegblgnunfaedh",,,,"id","0",,,"Gojek lang:in","0","0","0","Sekarang ojol di Jabodetabek itu minimal udah ada 4 aplikasi. Gojek, Grab, Maxim, Indrive.
Kalo emang gak dapet driver di Gojek ya coba pake Grab, gitu seterusnya.
Gimanapun juga lebih aman jika lewat aplikasi.","2023-10-31 04:45:00+00:00",,,"https://pbs.twimg.com/profile_images/1344848276999213057/T6pzJTmp_400x400.jpg",,,,,,,,,,,,,,,"1719214013006164267",,,,,,"https://twitter.com/KentangPotattoo/status/1719214013006164267","@KentangPotattoo"
,"🫧bunny 樂✯",,,,,"@mas1no",,,,"id","0",,,"Gojek lang:in","0","1","0","Di apk gojek ku tau2 juga muncul menu baru k** wkwkwk","2023-10-31 04:39:00+00:00",,,"https://pbs.twimg.com/profile_images/1710099263378882560/WJQXwl_c_400x400.jpg",,,,,,,,,,,,,,,"1719212598493847576",,,,,,"https://twitter.com/inolinokiciw/status/1719212598493847576","@inolinokiciw"
,"labirinboy",,,,,"@kumparan",,,,"id","7",,,"Gojek lang:in","0","0","0","Apk Gojek tuh ada, krn simple dan cpt, nego harga lagi malah jadinya wasting time gak sih 🙃","2023-10-31 04:38:00+00:00",,,"https://pbs.twimg.com/profile_images/1719037393440051201/YrTIU68z_400x400.jpg",,,,,,,,,,,,,,,"1719212237301358794",,,,,,"https://twitter.com/Labirin_boy/status/1719212237301358794","@Labirin_boy"
,"KINGDOM KUDETA",,,,,"@gyulittlepup",,,,"id","1",,,"Gojek lang:in","0","0","0","YEES bus dan kereta 500k minimum, hotel.... gojek atau transportasi umum... makan minum.... bisa sejuta sendiri total (atau lebih)","2023-10-31 04:44:00+00:00",,,"https://pbs.twimg.com/profile_images/1680741792818565120/0vFO7ftd_400x400.jpg",,,,,,,,,,,,,,,"1719213698194268480",,,,,,"https://twitter.com/KiGeprak/status/1719213698194268480","@KiGeprak"
,"nii",,,,,"@lixieys",,,,"hr","0",,,"Gojek lang:in","0","1","0","boti pake gojek ga sie 😭","2023-10-31 04:38:00+00:00",,,"https://pbs.twimg.com/profile_images/1597449030631534592/V42GfcYq_400x400.jpg",,,,,,,,,,,,,,,"1719212267563356578",,,,,,"https://twitter.com/niiwotw/status/1719212267563356578","@niiwotw"
,"apaandah",,,,,"@Heraloebss",,,,"id","0",,,"Gojek lang:in","0","0","0","Jadi inget pas beres konser blackpink, saking susahnya ga dapet2 grab gojek mybluebird dari 4 HP sekaligus, akhirnya nyari ojol yg mangkal trs lgsung ditembak harga sm dia 😅 yaa di oke-in aja dah daripada kaga pulang2 ke hotel","2023-10-31 04:41:00+00:00",,,"https://pbs.twimg.com/profile_images/1190470903265669120/5demExVm_400x400.jpg",,,,,,,,,,,,,,,"1719212969677164627",,,,,,"https://twitter.com/kapangdankamiww/status/1719212969677164627","@kapangdankamiww"
,"aye.",,,,,"@stonebreeze_",,,,"hr","0",,,"Gojek lang:in","0","1","0","Bisaa tapi lanjut pake gojek lagi","2023-10-31 04:31:00+00:00",,,"https://pbs.twimg.com/profile_images/1709184524209602560/84pd3tEo_400x400.jpg",,,,,,,,,,,,,,,"1719210463236653331",,,,,,"https://twitter.com/blackittySH/status/1719210463236653331","@blackittySH"
,"Arya Hazer Wins",,,,,"@kumparan",,,,"id","4",,,"Gojek lang:in","0","0","0","Akan ada suatu masa, dimana Gojek akan ada fitur pemesanan tanpa aplikasi 🤣","2023-10-31 04:36:00+00:00",,,"https://pbs.twimg.com/profile_images/1709577882769694721/A9S3NuOa_400x400.jpg",,,,,,,,,,,,,,,"1719211681853923726",,,,,,"https://twitter.com/sisteminforman/status/1719211681853923726","@sisteminforman"
,"hala",,,,,"@twenty8reason",,,,"id","0",,,"Gojek lang:in","0","1","0","oh.. 😭😭 iya sih yg boneless jrg kena promo… 

gabisa milih ya ayang? kemaren aku gojek perasaan bisa dipilihin, tp itu aku tulis di notes sih","2023-10-31 04:32:00+00:00",,,"https://pbs.twimg.com/profile_images/1715697009116790784/dz2jUrq8_400x400.jpg",,,,,,,,,,,,,,,"1719210796176277836",,,,,,"https://twitter.com/kisxtch/status/1719210796176277836","@kisxtch"
,"☻",,,,,"@kegblgnunfaedh",,,,"id","0",,,"Gojek lang:in","0","0","0","ni yg cocok dikroyok ojol mah yg kayak gini, mereka ga punya aplikasi tapi pake jaket gojek","2023-10-31 04:28:00+00:00",,,"https://pbs.twimg.com/profile_images/1708200233354805248/1dmFauVw_400x400.jpg",,,,,,,,,,,,,,,"1719209604507431191",,,,,,"https://twitter.com/chuka__wakame/status/1719209604507431191","@chuka__wakame"
,"aa oj3k",,,,,"@kumparan",,,,"id","3",,,"Gojek lang:in","0","3","0","gojek dan grab itu harus nya jadi Pioneer/contoh bagi aplikasi sejenis. Bukannya malah ngikutin indrive jadi ada nego2. Malah bikin lama ga efektif.
Driver : ""tinggal matiin aplikasi ride nya"" 😎🤣😅","2023-10-31 04:30:00+00:00",,,"https://pbs.twimg.com/profile_images/1603803585242071040/RvtC8WAu_400x400.jpg",,,,,,,,,,,,,,,"1719210247896915976",,,,,,"https://twitter.com/AaOj3k/status/1719210247896915976","@AaOj3k"
,"☻",,,,,"@b_setyagraha","@tarlagikaya","@kegblgnunfaedh",,"id","1",,,"Gojek lang:in","0","0","0","abangnya yg rekomendasiin diri pesen diluar apps bukan mbaknya minta coy. pesen gojek di area konser tuh susah. itu dia jg pasti terpaksa. dia mau komplain ke gojek ya sah2 aja, abang gojek jg udh jelas2 melanggar aturan gojek ko","2023-10-31 04:34:00+00:00",,,"https://pbs.twimg.com/profile_images/1708200233354805248/1dmFauVw_400x400.jpg",,,,,,,,,,,,,,,"1719211125089456592",,,,,,"https://twitter.com/chuka__wakame/status/1719211125089456592","@chuka__wakame"
,"Sigurosbrand","https://pbs.twimg.com/media/F9vNrnwbYAAGosR.jpg?format=jpg&name=medium",,,,,,,,"id","0",,,"Gojek lang:in","0","0","0","Gue secara pribadi suka pake Gojek karena ada kepastian harga. Kalau cocok, ambil, enggak, cari alternatif lain.

Kalau nego lagi mah mendingan langsung sama abangnya ajah.","2023-10-31 04:30:00+00:00",,,"https://pbs.twimg.com/profile_images/1702147480874610688/zS2axkM7_400x400.jpg",,,,,,,,,,,,,,,"1719210115570835616",,,,,,"https://twitter.com/mirzaldputra/status/1719210115570835616","@mirzaldputra"
,"jaenowin",,,,,"@kegblgnunfaedh",,,,"id","0",,,"Gojek lang:in","0","0","0","gw juga pernah tapi grab bukan gojek, gak komplain ke abang nya tapi langsung ke cs nya grab karna pembayaran langsung tarik dari saldo grab. setelah komplain akhirnya diproses, tapi harus ada bukti yang valid nya kalo gak ada bukti gabisa diproses","2023-10-31 04:33:00+00:00",,,"https://pbs.twimg.com/profile_images/1594596783648145410/OtchpAYW_400x400.jpg",,,,,,,,,,,,,,,"1719210971535921309",,,,,,"https://twitter.com/jeong_yoe/status/1719210971535921309","@jeong_yoe"
,"Ninin🦖",,,,,,,,,"id","2",,,"Gojek lang:in","0","1","0","Papaku gregetin bgt kan td abis anterin aku anter lamaran kerja trs aku bilang ""pa kalo misal yg ini keterima aku bawa motor aja ya ajarin sampe lancar trs biar dapet sim"" soalnya aku bisa bawa tp ga berani keluar ke jalan raya kan trs kata papaku ""gausa pake gojek aja"" 🙂🙂🙂🙂","2023-10-31 04:33:00+00:00",,,"https://pbs.twimg.com/profile_images/1699677739274686464/dvBgVt25_400x400.jpg",,,,,,,,,,,,,,,"1719210967295512608",,,,,,"https://twitter.com/anidablue/status/1719210967295512608","@anidablue"
,"ցuan✴︎ kode promo gojek📌","https://pbs.twimg.com/media/F9pl4JfbwAAUTId.jpg?format=jpg&name=medium",,,,,,,,"id","0",,,"Gojek lang:in","0","0","0","ini kalau merasa yg gabisa redeem/klaim kehabisan kode promo gojek, tunggu aja ya guys tiap senin, di redeem perminggu ya😉🫶🏼 nanti kode promo yang baru, bakal aku infoin senin besok, ditunggu yaww~","2023-10-31 04:25:00+00:00",,,"https://pbs.twimg.com/profile_images/1704323925952634880/A3FXzleq_400x400.jpg",,,,,,,,,,,,,,,"1719208880750927935",,,,,,"https://twitter.com/kyoongnanumi/status/1719208880750927935","@kyoongnanumi"
,"ann",,,,,"@rrizkikiki","@kegblgnunfaedh",,,"id","0",,,"Gojek lang:in","0","1","0","pernah ngalamin kaya gini, dr st. pasar turi ke bungurasih order di app 30k tapi gadapet2, trs ada bapak2 nawarin sesuai di apps, sampe tmpat aku kasih 50k emalah gadikasih kembalian katanya pas, udah ketinggalan kereta kena tipu gojek mana drivernya bau helmnya mw copot😔","2023-10-31 04:24:00+00:00",,,"https://pbs.twimg.com/profile_images/1551237732252676096/sIJSdPqD_400x400.jpg",,,,,,,,,,,,,,,"1719208810441810021",,,,,,"https://twitter.com/Annnt0_0N/status/1719208810441810021","@Annnt0_0N"
,"Mawa Kresna 𐤊","https://pbs.twimg.com/media/F9nHKA-bYAA9Cfu.jpg?format=jpg&name=medium","https://pbs.twimg.com/media/F9nHKL5bIAAsgj_.jpg?format=jpg&name=medium","https://pbs.twimg.com/media/F9nHKXFa0AAXr4y.jpg?format=jpg&name=medium","https://pbs.twimg.com/media/F9nHKjxbsAAcVFD.jpg?format=jpg&name=medium",,,,,"id","8262",,,"Gojek lang:in","721","368","1909","Apakah artinya menolak Israel yang memutus sumber air untuk Palestina tapi mendukung perampasan sumber air yang dilakukan Le Minerale di Pandeglang?","2023-10-30 09:36:00+00:00",,,"https://pbs.twimg.com/profile_images/1656669161647656961/IS2AEqY5_400x400.jpg",,,,,,,,,,,,,,,"1718924783071711722",,,,,,"https://twitter.com/mawakresna/status/1718924783071711722","@mawakresna"
,"bluevelvetunderground","https://pbs.twimg.com/media/F9vc7lMboAATkM8.jpg?format=jpg&name=medium",,,,"@madformakeup_co",,,,"no","0",,,"Gojek lang:in","0","1","0","flabbergasted di gojek (real)","2023-10-31 04:32:00+00:00",,,"https://pbs.twimg.com/profile_images/1679035757288374272/DUm5gYZd_400x400.jpg",,,,,,,,,,,,,,,"1719210605943706086",,,,,,"https://twitter.com/alshtabina/status/1719210605943706086","@alshtabina"
,"ON ! Kirim Menfess Via Telegram","https://pbs.twimg.com/media/F9vacDLbYAAar4k.jpg?format=jpg&name=medium",,,,,,,,"id","3",,,"Gojek lang:in","0","1","1","ugm_fess Buat kamu anak kampus yang belum punya GOJEK, nihh ada promo kece abis! 😬
Pakai kode promo 'GOJEKFEBRI' dan 'GOJEKCAMPUS' buat dapetin diskon total 175 ribu untuk GoRide, GoCar & GoFood, jadi bisa hemat buat jalan-jalan hingga makan enak deh😍 
Jangan  (cont..)","2023-10-31 04:21:00+00:00",,,"https://pbs.twimg.com/profile_images/1671650127151509505/8X0PUbUX_400x400.jpg",,,,,,,,,,,,,,,"1719207862239629342",,,,,,"https://twitter.com/UGM_FESS/status/1719207862239629342","@UGM_FESS"
,"ON ! Kirim Menfess Via Telegram",,,,,,,,,"id","0",,,"Gojek lang:in","0","0","0","sampe kelewatan, yukk buruan unduh GOJEK sekarangg💚","2023-10-31 04:21:00+00:00",,,"https://pbs.twimg.com/profile_images/1671650127151509505/8X0PUbUX_400x400.jpg",,,,,,,,,,,,,,,"1719207863950918033",,,,,,"https://twitter.com/UGM_FESS/status/1719207863950918033","@UGM_FESS"
